"data.list.id","title","date.created","rw.url"
"595228","Le second tour de l'élection présidentielle du Mali s'est déroulé dans le calme - MINUSMA",2013-08-13,"http://reliefweb.int/node/595228"
"595211","Second round of Mali’s presidential election occurs without incident – UN mission",2013-08-13,"http://reliefweb.int/node/595211"
"595167","Ibrahim B. Keïta nouveau président, son rival reconnaît sa défaite",2013-08-12,"http://reliefweb.int/node/595167"
"595166","Addressing structural problems",2013-08-12,"http://reliefweb.int/node/595166"
"595156","Malian Refugees Vote in Second Round of Presidential Elections",2013-08-12,"http://reliefweb.int/node/595156"
"595149","Les réfugiés maliens votent au second tour des élections présidentielles",2013-08-12,"http://reliefweb.int/node/595149"
"601786","Mali : Situation des structures scolaires affectées par le conflit au Nord - Cluster Education, Juillet 2013",2013-08-12,"http://reliefweb.int/node/601786"
"595004","150 observateurs de la CEDEAO pour superviser le second tour de l’élection présidentielle malienne",2013-08-12,"http://reliefweb.int/node/595004"
"594992","Former Mali premier Keita 'well ahead' in presidential race",2013-08-12,"http://reliefweb.int/node/594992"
"594907","Le Mali en crise a voté sans incidents au second tour de la présidentielle",2013-08-12,"http://reliefweb.int/node/594907"
"594887","UN assists in preparations for second round of Mali’s presidential election",2013-08-11,"http://reliefweb.int/node/594887"
"594886","Malians pick new president in crucial run-off",2013-08-11,"http://reliefweb.int/node/594886"
"594858","Mali on eve of presidential election",2013-08-10,"http://reliefweb.int/node/594858"
"594750","Malian returnees face problems",2013-08-09,"http://reliefweb.int/node/594750"
"594743","Fin d'une morne campagne avant le second tour de la présidentielle",2013-08-09,"http://reliefweb.int/node/594743"
"594709","Reengaging a post-conflict Mali",2013-08-09,"http://reliefweb.int/node/594709"
"594924","L'ONU soutient les préparatifs du second tour de l'élection présidentielle au Mali",2013-08-08,"http://reliefweb.int/node/594924"
"595222","Contribution de la société civile malienne au processus de sortie de crise",2013-08-08,"http://reliefweb.int/node/595222"
"594581","Challenges ahead after Mali's elections",2013-08-08,"http://reliefweb.int/node/594581"
"594538","In the aftermath of conflict, Mali's children remain at risk",2013-08-08,"http://reliefweb.int/node/594538"
"594513","Sahel Development Operational Report (MAA61004)",2013-08-08,"http://reliefweb.int/node/594513"
"594314","Sahel Humanitarian Dashboard (2013 Mid Year Review Update)",2013-08-07,"http://reliefweb.int/node/594314"
"594306","Analyse: Le problème de l'aide au Mali",2013-08-07,"http://reliefweb.int/node/594306"
"594242","Food security and humanitarian implications in West Africa and the Sahel - July 2013",2013-08-07,"http://reliefweb.int/node/594242"
"594188","Mali Food Security Outlook July through December 2013",2013-08-07,"http://reliefweb.int/node/594188"
"594119","Mali election: A Presidential run off",2013-08-06,"http://reliefweb.int/node/594119"
"597006","IDB Signs US $23.7 Million Agreement for Agricultural Project in Mali",2013-08-06,"http://reliefweb.int/node/597006"
"593975","Matrice de suivi des déplacements – Mali (Juillet 2013)",2013-08-06,"http://reliefweb.int/node/593975"
"593878","Témoignage sur les violences sexuelles",2013-08-06,"http://reliefweb.int/node/593878"
"593854","UNICEF Humanitarian Action for Children Mid-year update for Mali",2013-08-06,"http://reliefweb.int/node/593854"
"593806","Mali : urgence complexe Rapport de situation no 38 (5 août 2013)",2013-08-05,"http://reliefweb.int/node/593806"
"593805","Mali: Complex Emergency Situation Report No. 38 (as of 5 August 2013)",2013-08-05,"http://reliefweb.int/node/593805"
"593800","Mali : Aperçu humanitaire (au 2 août 2013)",2013-08-05,"http://reliefweb.int/node/593800"
"593700","Analysis: Mali’s aid problem",2013-08-05,"http://reliefweb.int/node/593700"
"593525","Le MNLA veut négocier un statut d'autonomie avec Bamako",2013-08-05,"http://reliefweb.int/node/593525"
"600267","Programme Cash Transfert",2013-08-04,"http://reliefweb.int/node/600267"
"593466","Cash transfer programme provides support to victims of violence in Mali",2013-08-03,"http://reliefweb.int/node/593466"
"593304","Présidentielle au Mali: un 2e tour entre Ibrahim B. Keïta et Soumaïla Cissé",2013-08-02,"http://reliefweb.int/node/593304"
"593286","Mali presidential vote goes to run-off",2013-08-02,"http://reliefweb.int/node/593286"
"593278","Food for hope in Mali",2013-08-02,"http://reliefweb.int/node/593278"
"593277","Des vivres pour redonner espoir",2013-08-02,"http://reliefweb.int/node/593277"
"593226","A victim of gender based violence in Mali tells her story",2013-08-02,"http://reliefweb.int/node/593226"
"593090","Présidentielle au Mali: report des résultats du premier tour à vendredi (officiel)",2013-08-01,"http://reliefweb.int/node/593090"
"593085","Sécurité alimentaire et implications humanitaires en Afrique de l’Ouest et au Sahel - juillet 2013",2013-08-01,"http://reliefweb.int/node/593085"
"593084","Mali delays vote result announcement to Friday",2013-08-01,"http://reliefweb.int/node/593084"
"592935","Situation remains calm in Mali: UNDP Resident Representative",2013-08-01,"http://reliefweb.int/node/592935"
"592923","Mali Perspectives sur la sécurité alimentaire juillet à décembre 2013",2013-08-01,"http://reliefweb.int/node/592923"
"592877","CRS continues assistance as Malians await election results",2013-07-31,"http://reliefweb.int/node/592877"
"592862","Mali Situation Update No 19 | 1 June 2013",2013-07-31,"http://reliefweb.int/node/592862"
"592844","Une polémique électorale qui risque de créer une nouvelle crise",2013-07-31,"http://reliefweb.int/node/592844"
"592617","Nigeria to start withdrawing troops from Mali: official",2013-07-31,"http://reliefweb.int/node/592617"
"592569","The Crisis Continues",2013-07-30,"http://reliefweb.int/node/592569"
"592517","Des réfugiés maliens votent lors de l'élection présidentielle",2013-07-30,"http://reliefweb.int/node/592517"
"608480","Evaluation de la sécurité alimentaire : Nord Mali - Gao, Tombouctou, Kidal et Mopti, Juillet 2013",2013-07-30,"http://reliefweb.int/node/608480"
"592483","Le retour progressif des réfugiés maliens dans leur pays",2013-07-30,"http://reliefweb.int/node/592483"
"592481","The ICRC in Mali",2013-07-30,"http://reliefweb.int/node/592481"
"592453","Détruire les restes explosifs de guerre",2013-07-30,"http://reliefweb.int/node/592453"
"592373","UN mission welcomes peaceful elections, stresses need to respect results",2013-07-30,"http://reliefweb.int/node/592373"
"592342","Mali's north remains tense as rebels prepare for peace talks",2013-07-30,"http://reliefweb.int/node/592342"
"592339","Participation massive pour le premier tour des élections présidentielles au Mali, selon l'ONU",2013-07-30,"http://reliefweb.int/node/592339"
"592337","Afrique de l’Ouest Bulletin Mensuel des Prix - Juillet 2013",2013-07-30,"http://reliefweb.int/node/592337"
"593229","Au Mali, mobilisation massive des électeurs",2013-07-29,"http://reliefweb.int/node/593229"
"592268","Mali Price Bulletin July 2013",2013-07-29,"http://reliefweb.int/node/592268"
"592252","Mali Bulletin des Prix - juillet 2013",2013-07-29,"http://reliefweb.int/node/592252"
"592223","Malians return to deadly grounds",2013-07-29,"http://reliefweb.int/node/592223"
"592220","Malian refugees take part in presidential election",2013-07-29,"http://reliefweb.int/node/592220"
"592104","Mali praised for successful election",2013-07-29,"http://reliefweb.int/node/592104"
"592086","Soulagement au Mali après une élection calme et réussie",2013-07-29,"http://reliefweb.int/node/592086"
"591996","Déclaration du porte-parole de Catherine Ashton, Haute Représentante de l'Union,  sur le déroulement de l'élection présidentielle au Mali",2013-07-29,"http://reliefweb.int/node/591996"
"591969","Le Mali en crise a voté sans incidents pour un nouveau président",2013-07-29,"http://reliefweb.int/node/591969"
"591964","Malians go to polls in watershed election",2013-07-29,"http://reliefweb.int/node/591964"
"591952","In Mali, Communities Grapple With Post-Traumatic Stress",2013-07-28,"http://reliefweb.int/node/591952"
"591931","Malians to defy death threats to vote in new leader",2013-07-28,"http://reliefweb.int/node/591931"
"591927","Malian rebel bastion to stage 'Caesarian section' election",2013-07-28,"http://reliefweb.int/node/591927"
"591933","Le Mali traumatisé par des mois de chaos vote pour élire son nouveau président",2013-07-27,"http://reliefweb.int/node/591933"
"591922","Mali on the brink of make-or-break election",2013-07-27,"http://reliefweb.int/node/591922"
"591911","Le Mali s'apprête à élire un nouveau président pour sortir du chaos",2013-07-27,"http://reliefweb.int/node/591911"
"591909","Frustration and hope ahead of Mali's polls",2013-07-27,"http://reliefweb.int/node/591909"
"591873","Ahead of Mali’s presidential election, Ban stresses need for peaceful, credible polls",2013-07-26,"http://reliefweb.int/node/591873"
"591823","L’élection présidentielle doit ouvrir la voie à un processus de paix, de justice et de réconciliation",2013-07-26,"http://reliefweb.int/node/591823"
"591796","Mali election: thousands of displaced people face exclusion from vote",2013-07-26,"http://reliefweb.int/node/591796"
"591744","Malian refugees trickling back home",2013-07-26,"http://reliefweb.int/node/591744"
"591737","Le HCR contribue à la préparation des élections pour les réfugiés maliens et exprime ses préoccupations quant à l'inscription des électeurs",2013-07-26,"http://reliefweb.int/node/591737"
"591736","Mali elections spark fears of more violence",2013-07-26,"http://reliefweb.int/node/591736"
"591731","Les femmes maliennes s’engagent pour des élections équitables et pacifiques",2013-07-26,"http://reliefweb.int/node/591731"
"591681","Humanitarian Implementation Plan (HIP) West Africa Sahel Region (ECHO/-WF/BUD/2013/91000) Last update: 09/07/13 Version 3",2013-07-26,"http://reliefweb.int/node/591681"
"591860","Sahel Crisis 2013: Funding Status as of 26 July 2013",2013-07-26,"http://reliefweb.int/node/591860"
"592785","Day 2 before the presidential elections in Mali: UN Volunteers prepare!",2013-07-26,"http://reliefweb.int/node/592785"
"592003","Présidentielle du 28 juillet au Mali: Ban appelle à la tenue d'un scrutin pacifique et crédible",2013-07-25,"http://reliefweb.int/node/592003"
"591997","Prise de fonction du Représentant spécial Adjoint pour le Mali",2013-07-25,"http://reliefweb.int/node/591997"
"591939","Les Maliens se préparent au scrutin, armés de leurs cartes d’électeurs",2013-07-25,"http://reliefweb.int/node/591939"
"591938","Voters in Mali prepare to cast their ballots in the presidential election",2013-07-25,"http://reliefweb.int/node/591938"
"591535","Mali : la crise n’est pas terminée",2013-07-25,"http://reliefweb.int/node/591535"
"591521","A trois jours des présidentielles, craintes et espoirs",2013-07-25,"http://reliefweb.int/node/591521"
"591504","Children Return after a year in exile",2013-07-25,"http://reliefweb.int/node/591504"
"591503","Mali: Airports and UNHAS Routes (as of 24 July 2013)",2013-07-25,"http://reliefweb.int/node/591503"
"591470","Mali Candidates Pledge Reconciliation",2013-07-25,"http://reliefweb.int/node/591470"
"591455","Mali Operation: Key indicator trend as of 30 June 2013",2013-07-25,"http://reliefweb.int/node/591455"
"591450","Billions for Mali: Hunger despite generous pledges",2013-07-25,"http://reliefweb.int/node/591450"
"591398","La menace jihadiste en baisse au Mali, en hausse chez ses voisins",2013-07-25,"http://reliefweb.int/node/591398"
"591384","Election Presidentielle au Mali",2013-07-25,"http://reliefweb.int/node/591384"
"592345","Le Secrétaire général de la Francophonie dépêche une mission d’information et de contact à l’occasion de l’élection présidentielle",2013-07-24,"http://reliefweb.int/node/592345"
"591298","When it rains in Mali, it pours",2013-07-24,"http://reliefweb.int/node/591298"
"591119","Mali to remain 'on life support' after election: analysts",2013-07-24,"http://reliefweb.int/node/591119"
"591112","TSF connecte un nouveau camp de réfugiés à Mangaizé et réactive la connexion à Banibangou en soutien aux réfugiés maliens",2013-07-24,"http://reliefweb.int/node/591112"
"592011","Mission d’observation de l’Union africaine a l’occasion de l’élection présidentielle du 28 juillet 2013 au Mali - Déclaration préélectorale",2013-07-23,"http://reliefweb.int/node/592011"
"592010","Mission d’observation de l’Union africaine a l’occasion de l’élection présidentielle du 28 juillet 2013 au Mali - Déclaration d’arrivee",2013-07-23,"http://reliefweb.int/node/592010"
"591035","Mali Elections to Go On, As Delay Has Risks",2013-07-23,"http://reliefweb.int/node/591035"
"591019","Sécurité nutritionnelle à Gao : Un état des lieux alarmant",2013-07-23,"http://reliefweb.int/node/591019"
"591016","Nutrition security in Gao: An alarming situation",2013-07-23,"http://reliefweb.int/node/591016"
"590902","UNHCR urges speeding of preparations for refugee vote in Mali elections",2013-07-23,"http://reliefweb.int/node/590902"
"590895","ACT helps revive troubled north Mali city",2013-07-23,"http://reliefweb.int/node/590895"
"590887","The Sahel: 2011-2013 CERF allocations (as of 27 June 2013)",2013-07-23,"http://reliefweb.int/node/590887"
"590869","Food security and humanitarian implications in West Africa and the Sahel - June 2013",2013-07-23,"http://reliefweb.int/node/590869"
"590824","Première réunion du Comité de Suivi et d’Evaluation",2013-07-23,"http://reliefweb.int/node/590824"
"590823","La composante Police de la MINUSMA forme les forces de l’ordre maliennes au maintien de la paix",2013-07-23,"http://reliefweb.int/node/590823"
"590733","Dirk Niebel com­mits an ad­di­tion­al 5 mil­lion euros for Mali and other Sahel countries",2013-07-22,"http://reliefweb.int/node/590733"
"590711","Conclusions du Conseil relatives au Mali, 22 juillet 2013",2013-07-22,"http://reliefweb.int/node/590711"
"590608","Mali: Tableau de bord humanitaire (au 19 juillet 2013)",2013-07-22,"http://reliefweb.int/node/590608"
"590574","Nombreux obstacles au bon déroulement de la présidentielle",2013-07-22,"http://reliefweb.int/node/590574"
"590448","Des rebelles touareg parlent de paix à Bamako, tensions dans le Nord",2013-07-22,"http://reliefweb.int/node/590448"
"590445","Les agents électoraux enlevés dans la région de Kidal ont été libérés",2013-07-22,"http://reliefweb.int/node/590445"
"590440","Le Mali à une semaine d'une présidentielle déjà contestée",2013-07-20,"http://reliefweb.int/node/590440"
"590410","Polling officials among six abducted in northern Mali",2013-07-20,"http://reliefweb.int/node/590410"
"590405","Mali: enlèvements dans la région de Kidal à huit jours de la présidentielle",2013-07-20,"http://reliefweb.int/node/590405"
"590345","Mali: Complex Emergency Situation Report no. 37 (as of 19 July 2013)",2013-07-19,"http://reliefweb.int/node/590345"
"590307","Kidal : Violences entre des communautés noires et Touareg, ombre sur les élections",2013-07-19,"http://reliefweb.int/node/590307"
"590259","Le RSSG visite les familles fondatrices de Bamako",2013-07-19,"http://reliefweb.int/node/590259"
"590249","Deadly pre-poll clashes in Mali flashpoint town",2013-07-19,"http://reliefweb.int/node/590249"
"590246","Mali: des violences font quatre morts à Kidal avant la présidentielle",2013-07-19,"http://reliefweb.int/node/590246"
"590237","Structural approach to hunger in Sahel and Horn of Africa",2013-07-19,"http://reliefweb.int/node/590237"
"590213","An Ongoing Crisis",2013-07-19,"http://reliefweb.int/node/590213"
"590343","Mali : Urgence complexe Rapport de situation no 37 (19 juillet 2013)",2013-07-19,"http://reliefweb.int/node/590343"
"590157","Nigeria to pull many peacekeepers from Mali, Darfur",2013-07-19,"http://reliefweb.int/node/590157"
"590139","La crise crée des opportunités inattendues pour les enfants déplacés au Mali",2013-07-18,"http://reliefweb.int/node/590139"
"590099","W. Africa leaders insist Mali polls will go ahead on July 28",2013-07-18,"http://reliefweb.int/node/590099"
"590084","Urgence Mali : Handicap International lance un appel à dons",2013-07-18,"http://reliefweb.int/node/590084"
"590057","Présidentielle au Mali : La Cédéao n'a ""plus de doutes"" sur le respect de la date du 28 juillet",2013-07-18,"http://reliefweb.int/node/590057"
"590048","Tackling hunger in the Sahel: the challenge of resilience",2013-07-18,"http://reliefweb.int/node/590048"
"589897","Nigeria Seeks $25M for Mali Elections",2013-07-18,"http://reliefweb.int/node/589897"
"589761","Addressing structural problems",2013-07-17,"http://reliefweb.int/node/589761"
"589734","Timbuktu Sees Return of Humanitarian Operations",2013-07-17,"http://reliefweb.int/node/589734"
"589646","Mali, Guinea-Bissau to dominate ECOWAS 43rd ordinary summit",2013-07-17,"http://reliefweb.int/node/589646"
"589630","Security Council Issues Presidential Statement Strongly Condemning Human Rights Abuses, Violence against Civilians in Sahel",2013-07-17,"http://reliefweb.int/node/589630"
"589620","West Africa Seasonal Monitor - July 16, 2013",2013-07-16,"http://reliefweb.int/node/589620"
"589499","Mali : Appel global - Revue à mi-parcours 2013",2013-07-16,"http://reliefweb.int/node/589499"
"589491","Les Humanitaires en Action - Juillet 2013",2013-07-16,"http://reliefweb.int/node/589491"
"589326","Sahel and West Africa Food Security Outlook Update June 2013",2013-07-16,"http://reliefweb.int/node/589326"
"589300","Présidentielle au Mali: un des principaux candidats se rend à Kidal",2013-07-15,"http://reliefweb.int/node/589300"
"589294","Presidential favourite visits flashpoint town in Mali",2013-07-15,"http://reliefweb.int/node/589294"
"589212","Les réfugiés dans l’attente des élections",2013-07-15,"http://reliefweb.int/node/589212"
"589165","Ladsous ""Situation of Sudan is worrying""",2013-07-15,"http://reliefweb.int/node/589165"
"589647","ECOWAS urged to re-examine its crises response mechanisms",2013-07-15,"http://reliefweb.int/node/589647"
"588968","Mali minister vows election will go ahead, warns opponents",2013-07-13,"http://reliefweb.int/node/588968"
"588937","Mali's rush to post-war election raises fears of further strife",2013-07-12,"http://reliefweb.int/node/588937"
"588786","DRC responds to emergency crisis in North of Mali",2013-07-12,"http://reliefweb.int/node/588786"
"588616","Bureau régional pour l'Afrique de l'ouest et du centre - Bulletin - Fond central d'interventions d'urgence,  deuxième trimestre 2013",2013-07-11,"http://reliefweb.int/node/588616"
"588614","Regional Office for West and Central Africa Bulletin - Central Emergency Response Fund, Second Quarter 2013",2013-07-11,"http://reliefweb.int/node/588614"
"588547","Mali: le gouverneur de Kidal repart après quelques heures dans la ville",2013-07-11,"http://reliefweb.int/node/588547"
"588500","Governor of flashpoint Mali town leaves after brief visit",2013-07-11,"http://reliefweb.int/node/588500"
"588415","L’Afrique de l’Ouest mérite une « attention accrue des Nations Unies », souligne le Représentant spécial du Secrétaire général",2013-07-11,"http://reliefweb.int/node/588415"
"588364","Briefing on West Africa, Top Envoy informs Security Council of efforts under way to shore up stability, democratic processes in still vulnerable subregion",2013-07-10,"http://reliefweb.int/node/588364"
"588306","Climate Prediction Center’s Africa Hazards Outlook For USAID / FEWS-NET July 11 – July 17, 2013",2013-07-10,"http://reliefweb.int/node/588306"
"588303","Mali’s displaced people face uncertain future",2013-07-10,"http://reliefweb.int/node/588303"
"588116","Crisis leads to unexpected opportunities for displaced children in Mali",2013-07-10,"http://reliefweb.int/node/588116"
"588072","Two civilians wounded in northern Mali rebel stronghold",2013-07-09,"http://reliefweb.int/node/588072"
"588063","Deux blessés graves à Kidal, évacués sur Gao",2013-07-09,"http://reliefweb.int/node/588063"
"588061","Exchanging One Crisis for Another?",2013-07-09,"http://reliefweb.int/node/588061"
"587893","Mali: Food Insecurity (MDRML009) Final Report",2013-07-09,"http://reliefweb.int/node/587893"
"587842","Ban Ki-moon nomme Abdoulaye Bathily, du Sénégal, Représentant spécial adjoint pour le Mali",2013-07-09,"http://reliefweb.int/node/587842"
"587841","Ban Ki-moon nomme David Gressly, des Etats-Unis, Représentant spécial adjoint pour le Mali",2013-07-09,"http://reliefweb.int/node/587841"
"592016","La Suisse s’investit pour des élections transparentes au Mali",2013-07-08,"http://reliefweb.int/node/592016"
"592020","SOS Démocratie prépare les citoyens maliens à voter dans les meilleures conditions",2013-07-08,"http://reliefweb.int/node/592020"
"587678","Tension à Kidal après l'arrivée de l'armée malienne",2013-07-08,"http://reliefweb.int/node/587678"
"587676","Sahel Regional Strategy Mid-Year Review 2013 - Reference Map (as of 04 Jul 2013)",2013-07-08,"http://reliefweb.int/node/587676"
"587671","Sécurité alimentaire et implications humanitaires en Afrique de l’Ouest et au Sahel - juin 2013",2013-07-08,"http://reliefweb.int/node/587671"
"587656","Mali's army accuses Tuaregs of violating peace deal",2013-07-08,"http://reliefweb.int/node/587656"
"587633","Analyse: Solutions à court terme - les déboires de l'agriculture en Afrique de l'Ouest",2013-07-08,"http://reliefweb.int/node/587633"
"587508","Besoins humanitaires croissants au Sahel",2013-07-08,"http://reliefweb.int/node/587508"
"587507","Début de campagne présidentielle au Mali: un scrutin pour sortir de la crise",2013-07-08,"http://reliefweb.int/node/587507"
"587485","Analysis: Short-term fixes - the bane of West African agriculture",2013-07-07,"http://reliefweb.int/node/587485"
"587478","Managing Price Risk in Local Food Reserves: Analysing the prospects for a stabilisation fund in Mali and Niger",2013-07-07,"http://reliefweb.int/node/587478"
"587470","From the Field: UN food relief agency struggles to cope with Mali’s ‘lean season’",2013-07-06,"http://reliefweb.int/node/587470"
"587463","Mali lifts state of emergency in place since January",2013-07-06,"http://reliefweb.int/node/587463"
"587506","Etat d'urgence levé au Mali à la veille de la campagne présidentielle",2013-07-05,"http://reliefweb.int/node/587506"
"587445","L'ONU salue les avancées du processus de normalisation à Kidal au Mali",2013-07-05,"http://reliefweb.int/node/587445"
"587443","Doubts Linger Over U.N. Troops’ Preparedness to Enter Mali",2013-07-05,"http://reliefweb.int/node/587443"
"587430","Mali: 28 candidats retenus pour la présidentielle",2013-07-05,"http://reliefweb.int/node/587430"
"587412","Candidates announced for Mali election",2013-07-05,"http://reliefweb.int/node/587412"
"587392","Mali: l'armée entre à Kidal trois semaines avant la présidentielle",2013-07-05,"http://reliefweb.int/node/587392"
"587390","Malian troops enter rebel-held northern town",2013-07-05,"http://reliefweb.int/node/587390"
"587379","European Union launches Election Observation Mission to Mali",2013-07-05,"http://reliefweb.int/node/587379"
"587363","L'Union européenne lance une Mission d'observation électorale au Mali",2013-07-05,"http://reliefweb.int/node/587363"
"587343","Mali : Urgence complexe Rapport de situation no 36 (05 juillet 2013)",2013-07-05,"http://reliefweb.int/node/587343"
"587342","Mali: Complex Emergency Situation Report No. 36 (as of 5 July 2013)",2013-07-05,"http://reliefweb.int/node/587342"
"589648","ECOWAS launches regional agricultural market website",2013-07-05,"http://reliefweb.int/node/589648"
"587167","Sahel Regional Strategy Mid-Year Review 2013",2013-07-04,"http://reliefweb.int/node/587167"
"587144","Un año después de la crisis de 2012, Sahel sigue siendo el epicentro del hambre",2013-07-04,"http://reliefweb.int/node/587144"
"587082","Un milliard de dollars encore nécessaires pour les urgences dans le Sahel",2013-07-04,"http://reliefweb.int/node/587082"
"587005","Report of the Secretary-General on the activities of the United Nations Office for West Africa (S/2013/384)",2013-07-04,"http://reliefweb.int/node/587005"
"587125","Humanitarian needs rise in Sahel",2013-07-04,"http://reliefweb.int/node/587125"
"587073","One billion dollars still required for emergencies in the Sahel",2013-07-04,"http://reliefweb.int/node/587073"
"586949","World Bank to Help Mali Improve Seeds, Fertilizers, and other Agriculture Technologies with Regional Support",2013-07-04,"http://reliefweb.int/node/586949"
"586940","Conflict not over for the displaced and refugees",2013-07-04,"http://reliefweb.int/node/586940"
"592015","La Suisse apporte son aide aux Maliens touchés par la crise sécuritaire",2013-07-03,"http://reliefweb.int/node/592015"
"586851","Climate Prediction Center’s Africa Hazards Outlook For USAID / FEWS-NET July 4 – July 10, 2013",2013-07-03,"http://reliefweb.int/node/586851"
"586636","UNICEF Mali Situation Report, June 2013",2013-07-02,"http://reliefweb.int/node/586636"
"586527","Les Casques bleus prennent la relève au Mali",2013-07-02,"http://reliefweb.int/node/586527"
"586499","Mali polls to go ahead despite fears over readiness",2013-07-02,"http://reliefweb.int/node/586499"
"586494","Premier tour de la présidentielle maintenu le 28 juillet (ministre malien)",2013-07-02,"http://reliefweb.int/node/586494"
"586372","General Assembly adopts 2013/14 peacekeeping budget approaching $8 billion for 14 operations, acting on fifth committee recommendations",2013-07-02,"http://reliefweb.int/node/586372"
