"data.list.id","title","date.created","rw.url"
"633260","Security in the Sahel: Part I – Stabilising Mali in 2013-14",2014-01-29,"http://reliefweb.int/node/633260"
"633237","Le Mali après Serval : éviter la rechute",2014-01-29,"http://reliefweb.int/node/633237"
"633206","Mission impossible in Mali",2014-01-29,"http://reliefweb.int/node/633206"
"633117","Bureau Régional pour l’Afrique de l’Ouest et du Centre Bulletin - Fond Central d’Intervention d’Urgence
Quatrième trimestre 2013",2014-01-29,"http://reliefweb.int/node/633117"
"633113","Regional Office for West and Central Africa Bulletin - Central Emergency Response Fund Fourth Quarter 2013",2014-01-29,"http://reliefweb.int/node/633113"
"632949","Lutheran World Relief and Margaret A. Cargill Foundation Assist 100,000 Farmers in West Africa",2014-01-28,"http://reliefweb.int/node/632949"
"632861","Escape from extreme poverty in Mali",2014-01-28,"http://reliefweb.int/node/632861"
"632657","Mali Bulletin humanitaire, janvier 2014",2014-01-27,"http://reliefweb.int/node/632657"
"632655","Humanitarian Bulletin Mali January 2014",2014-01-27,"http://reliefweb.int/node/632655"
"632452","Rapport d’atelier - Présidence de la République, Commissariat a la sécurité alimentaire, Systeme d’alerte précoce",2014-01-27,"http://reliefweb.int/node/632452"
"632448","Mali : Points de suivi des mouvements de populations - Flow monitoring points (FMP) du 12 au 18 Janvier 2014",2014-01-27,"http://reliefweb.int/node/632448"
"632194","Paris réorganise son dispositif au Sahel pour lutter contre les jihadistes",2014-01-24,"http://reliefweb.int/node/632194"
"631918","Mali Price Bulletin January 2014",2014-01-24,"http://reliefweb.int/node/631918"
"631892","Préoccupé par la situation dans le nord du Mali, le Conseil de sécurité demande aux parties de coopérer pleinement au déploiement de la MINUSMA",2014-01-24,"http://reliefweb.int/node/631892"
"631824","Security Council Welcomes Successful Elections in Mali, while Expressing Concern over ‘Fragile’ Situation Affecting Northern Region (S/PRST/2014/2)",2014-01-23,"http://reliefweb.int/node/631824"
"631799","Remote Mali communities break-out of aid dependency",2014-01-23,"http://reliefweb.int/node/631799"
"631493","Drops of Hope",2014-01-23,"http://reliefweb.int/node/631493"
"631422","Sahel – Disaster Risk Management: Development Operational Plan 2014",2014-01-22,"http://reliefweb.int/node/631422"
"631252","Mali : Présence opérationnelle des partenaires par activités - décembre 2013 (Cercle)",2014-01-22,"http://reliefweb.int/node/631252"
"630884","Nord du Mali : un véhicule de l'ONU saute sur une mine, 5 blessés légers (Minusma)",2014-01-21,"http://reliefweb.int/node/630884"
"630887","Five injured as UN vehicle in Mali hits landmine",2014-01-21,"http://reliefweb.int/node/630887"
"630702","Point sur la situation alimentaire au Sahel - Suivi de campagne n°152 - début décembre 2013",2014-01-20,"http://reliefweb.int/node/630702"
"630695","Point sur la situation alimentaire au Sahel - Suivi de campagne n°153 - début janvier 2014",2014-01-20,"http://reliefweb.int/node/630695"
"630683","Rapport de la Mission d’Observation de l’Union Africaine au premier tour des élections législatives du 24 novembre 2013 en République de Mali",2014-01-20,"http://reliefweb.int/node/630683"
"630441","ECHO and UNICEF join forces for crisis affected children to go back to school",2014-01-18,"http://reliefweb.int/node/630441"
"630428","Resilience: Why does it matter to the humanitarian community? Sahel as a case study",2014-01-17,"http://reliefweb.int/node/630428"
"630393","Le Mali et le FIDA signent un accord de financement de 33,2 millions d'USD",2014-01-17,"http://reliefweb.int/node/630393"
"630254","Agir pour protéger les vies",2014-01-17,"http://reliefweb.int/node/630254"
"630247","Insecurity in the Gulf of Guinea: Assessing the Threat, Preparing the Response",2014-01-17,"http://reliefweb.int/node/630247"
"630215","GIEWS Country Brief: Mali 16-January-2014",2014-01-17,"http://reliefweb.int/node/630215"
"630168","Conseil de sécurité : M. Albert Koenders demande à la communauté internationale d’appuyer le Mali à poser les bases durables pour la paix et la réconciliation",2014-01-17,"http://reliefweb.int/node/630168"
"630079","Continuing international support crucial in helping Mali avert relapse into 2012 crisis situation, Security Council told",2014-01-16,"http://reliefweb.int/node/630079"
"629919","Mali : Global Education Cluster - Activités des partenaires, Janvier 2014 (Année scolaire 2013-2014)",2014-01-16,"http://reliefweb.int/node/629919"
"629913","Mali's Dogon hit by double crisis",2014-01-16,"http://reliefweb.int/node/629913"
"629750","Un nouveau vaccin au Mali pour réduire les diarrhées mortelles chez les enfants",2014-01-15,"http://reliefweb.int/node/629750"
"629641","Mali : Aperçu Humanitaire (au 31 décembre 2013)",2014-01-15,"http://reliefweb.int/node/629641"
"629620","Rapport de l’Expert indépendant sur la situation des droits de l’homme au Mali, Suliman Baldo (A/HRC/25/72)",2014-01-15,"http://reliefweb.int/node/629620"
"628966","Cluster Education : Analyse de la situation humanitaire 2014",2014-01-13,"http://reliefweb.int/node/628966"
"628790","Mali, Mauritania ink deal on fight against 'terrorist groups'",2014-01-12,"http://reliefweb.int/node/628790"
"628591","Mali : réformer ou rechuter",2014-01-10,"http://reliefweb.int/node/628591"
"628582","Mali: Reform or Relapse",2014-01-10,"http://reliefweb.int/node/628582"
"628367","Report of the Secretary-General on the situation in Mali (S/2014/1)",2014-01-09,"http://reliefweb.int/node/628367"
"628364","Mali at the Dawn of the New Year: From Crisis to Recovery",2014-01-09,"http://reliefweb.int/node/628364"
"628322","UNHCR position on returns to Mali - Update I",2014-01-09,"http://reliefweb.int/node/628322"
"628028","Mali : les effectifs militaires français ramenés mi-février de 2.500 hommes à 1.600",2014-01-08,"http://reliefweb.int/node/628028"
"628022","France to cut troops in Mali, says mission accomplished",2014-01-08,"http://reliefweb.int/node/628022"
"627863","Rapport d’enquête rapide sur la vulnerabilite alimentaire des menages dans les cercles de Bandiagara, Nara et Tenenkou, Mali - Enquête réalisée du 28 octobre au 06 novembre 2013",2014-01-08,"http://reliefweb.int/node/627863"
"627819","A year of clashes and political transition",2014-01-08,"http://reliefweb.int/node/627819"
"627531","Former refugees receive household essentials [Slideshow]",2014-01-06,"http://reliefweb.int/node/627531"
"627507","Distribution d’articles ménagers de première nécessité à d’anciens réfugiés [Diaporama]",2014-01-06,"http://reliefweb.int/node/627507"
"627488","Plan d’Actions Prioritaires pour le Nord du Mali - Rapport mensuel : Novembre 2013",2014-01-06,"http://reliefweb.int/node/627488"
"627479","U.S. African Development Foundation in 2013 - A Year in Review",2014-01-06,"http://reliefweb.int/node/627479"
"627436","Mali : Représentation cartographique du nombre d'enfants attendus en Malnutrition Aiguë par District Sanitaire en 2014 (Burden MAG 2014)",2014-01-06,"http://reliefweb.int/node/627436"
"627432","Mali : Représentation cartographique du nombre d'enfants attendus en Malnutrition Aiguë Sévère par District Sanitaire en 2014 (Burden MAS 2014)",2014-01-06,"http://reliefweb.int/node/627432"
"627424","Mali : Représentation cartographique du nombre d'enfants attendus en Malnutrition Aiguë Modérée par District Sanitaire en 2014 (Burden MAM 2014)",2014-01-06,"http://reliefweb.int/node/627424"
"626768","In Mali, HIV/AIDS remains shrouded in silence",2014-01-01,"http://reliefweb.int/node/626768"
"626578","La MINUSMA et la force SERVAL neutralisent 5,7 tonnes d'explosifs dans le nord du Mali",2013-12-31,"http://reliefweb.int/node/626578"
"626577","Mali on the Mend as Reforms Resume after Security Crisis",2013-12-31,"http://reliefweb.int/node/626577"
"626576","Le Mali se redresse et renoue avec les réformes au sortir de la crise sécuritaire",2013-12-31,"http://reliefweb.int/node/626576"
"626422","The ETC in Mali establishes and maintains essential communications services so that the relief community has the support to do what is does best - save lives.",2013-12-30,"http://reliefweb.int/node/626422"
"626234","Mali's government presents treason case against former president",2013-12-28,"http://reliefweb.int/node/626234"
"626116","West Africa Price Bulletin December 2013",2013-12-27,"http://reliefweb.int/node/626116"
"625845","Mali : 3W - Présence Opérationnelle - Novembre 2013 (Cercle)",2013-12-26,"http://reliefweb.int/node/625845"
"625842","Mali : 3W - Aide alimentaire directe / Présence Opérationnelle Nov. 2013 (Cercle)",2013-12-26,"http://reliefweb.int/node/625842"
"625821","MINUSMA : les Togolais s’équipent",2013-12-26,"http://reliefweb.int/node/625821"
"626254","Mali – Complex Emergency ETC Situation Report #29 Reporting period 26/11/13 to 25/12/13",2013-12-25,"http://reliefweb.int/node/626254"
"625593","Mali Price Bulletin December 2013",2013-12-24,"http://reliefweb.int/node/625593"
"625380","Mali : CAP 2013 - Suivi des Financements (au 20 décembre 2013)",2013-12-23,"http://reliefweb.int/node/625380"
"625084","Mali: Reference Map (as of 29 Nov 2013)",2013-12-20,"http://reliefweb.int/node/625084"
"625055","Bulletin d’information sur la Sécurité Alimentaire et nutritionelle en Afrique de l’Ouest - novembre 2013",2013-12-20,"http://reliefweb.int/node/625055"
"624659","ECOWAS to deliver food assistance to Mali",2013-12-19,"http://reliefweb.int/node/624659"
"624425","IFAD approves US$88m for smallholder farmers to adapt to climate change",2013-12-19,"http://reliefweb.int/node/624425"
"624412","Prévention de la torture au Mali : l'OIF soutient la mise en place d'un Mécanisme national de prévention",2013-12-19,"http://reliefweb.int/node/624412"
"624408","Le Conseil d’administration du FMI approuve un nouvel accord en faveur du Mali au titre de la facilité élargie de crédit et un décaissement de 9,2 millions de dollars",2013-12-19,"http://reliefweb.int/node/624408"
"624402","IMF Executive Board Approves New Extended Credit Facility Arrangement for Mali and US$9.2 Million Disbursement",2013-12-19,"http://reliefweb.int/node/624402"
"624344","Sécurité alimentaire et implications humanitaires en Afrique de l’Ouest et au Sahel - novembre/décembre 2013",2013-12-18,"http://reliefweb.int/node/624344"
"624322","Sensibilisation à l'importance des actes d’état civil au Mali",2013-12-18,"http://reliefweb.int/node/624322"
"624317","La mission d’observateurs de la CEDEAO félicite les maliens pour la bonne organisation des législatives",2013-12-18,"http://reliefweb.int/node/624317"
"624235","Message du Mali : trouvez les enfants, soignez-les à un stade précoce",2013-12-18,"http://reliefweb.int/node/624235"
"624131","Rebuilding West Africa's Food Potential: Policies and market incentives for smallholder-inclusive food value chains",2013-12-18,"http://reliefweb.int/node/624131"
"624088","Communiqué de la Mission d’information et de contacts de la Francophonie dépêchée à l’occasion du second tour des élections législatives au Mali du 15 décembre 2013",2013-12-18,"http://reliefweb.int/node/624088"
"624046","West Africa remains ‘fragile’ and needs ongoing support, UN envoy tells Security Council",2013-12-18,"http://reliefweb.int/node/624046"
"624028","West Africa hopes new hydropower dams will cut poverty, climate risk",2013-12-18,"http://reliefweb.int/node/624028"
"624018","Malian president's party wins parliamentary polls: government",2013-12-17,"http://reliefweb.int/node/624018"
"624017","Législatives au Mali : victoire du parti présidentiel et de ses alliés (officiel)",2013-12-17,"http://reliefweb.int/node/624017"
"623978","Humanitarian Bulletin Mali November 2013",2013-12-17,"http://reliefweb.int/node/623978"
"623977","Mali Bulletin humanitaire, novembre 2013",2013-12-17,"http://reliefweb.int/node/623977"
"623883","Mali:  Points de suivi des mouvements de populations - Flow monitoring points (FMP) du 08 au 14 Déc. 2013",2013-12-17,"http://reliefweb.int/node/623883"
"623756","L’Union africaine condamne l’attentat terroriste de Kidal contre les forces des Nations Unies",2013-12-17,"http://reliefweb.int/node/623756"
"623754","The African Union condemns the Kidal terrorist attack against United Nations forces",2013-12-17,"http://reliefweb.int/node/623754"
"623670","Giving new hope to dispersed families",2013-12-16,"http://reliefweb.int/node/623670"
"623658","Le RSSG Albert Koenders salue le bon déroulement du second tour des élections législatives au Mali",2013-12-16,"http://reliefweb.int/node/623658"
"623649","Mali : redonner espoir aux familles dispersées",2013-12-16,"http://reliefweb.int/node/623649"
"623626","Mali: Humanitarian Snapshot (as of 30 November 2013)",2013-12-16,"http://reliefweb.int/node/623626"
"623625","Mali election met international standards: EU",2013-12-16,"http://reliefweb.int/node/623625"
"623600","Législatives au Mali: un scrutin ""aux normes internationales"" (UE)",2013-12-16,"http://reliefweb.int/node/623600"
"623462","Mali: Aperçu de la rentrée scolaire 2013-2014 au Nord",2013-12-16,"http://reliefweb.int/node/623462"
"623402","La CEDEAO va déployer 50 observateurs dans le cadre des législatives au Mali",2013-12-16,"http://reliefweb.int/node/623402"
"623364","Malians vote in run-off legislative elections",2013-12-16,"http://reliefweb.int/node/623364"
"623363","Mali vote turnout weak following Islamist suicide bombing",2013-12-16,"http://reliefweb.int/node/623363"
"623361","Les Maliens ont voté sans enthousiasme après l'attentat de Kidal",2013-12-16,"http://reliefweb.int/node/623361"
"623293","Ban and Security Council condemn deadly attack on UN, Malian forces",2013-12-15,"http://reliefweb.int/node/623293"
"623279","Suicide attack in Mali kills two Senegalese soldiers",2013-12-14,"http://reliefweb.int/node/623279"
"623274","Nord du Mali: deux soldats sénégalais tués dans un attentat jihadiste à Kidal",2013-12-14,"http://reliefweb.int/node/623274"
"623273","La MINUSMA condamne fermement l’attentat à la voiture piégée contre les troupes à Kidal",2013-12-14,"http://reliefweb.int/node/623273"
"623315","Mali elections overshadowed by suicide bombing",2013-12-14,"http://reliefweb.int/node/623315"
"623397","L'ONU condamne fermement une attaque à Kidal qui a causé la mort de deux Casques bleus",2013-12-13,"http://reliefweb.int/node/623397"
"623222","The Human Chain [Video]",2013-12-13,"http://reliefweb.int/node/623222"
"623192","French troops stage 'very large' anti-Islamist op in Mali",2013-12-13,"http://reliefweb.int/node/623192"
"623052","Find the child, treat them early: message from Mali",2013-12-13,"http://reliefweb.int/node/623052"
"623047","Plan d’Actions Prioritaires pour le Nord du Mali - Rapport mensuel : Octobre 2013",2013-12-13,"http://reliefweb.int/node/623047"
"622945","In Presidential Statement on Sahel, Security Council Condemns Violence against Civilians, Reaffirms Strong Commitment to Region - S/PRST/2013/20",2013-12-13,"http://reliefweb.int/node/622945"
"622720","Second tour des législatives au Mali dimanche, dernière étape du retour à l'ordre constitutionnel",2013-12-12,"http://reliefweb.int/node/622720"
"622285","Mali Food Security Outlook Update November 2013",2013-12-11,"http://reliefweb.int/node/622285"
"622173","Situation Update: The Sahel Crisis - 10 December 2013",2013-12-10,"http://reliefweb.int/node/622173"
"623876","Mali Humanitarian Dashboard (as of 10 December 2013) [EN/FR]",2013-12-10,"http://reliefweb.int/node/623876"
"621784","Agenda pour les droits humains",2013-12-09,"http://reliefweb.int/node/621784"
"621597","World Bank Approves Funds to Boost Infrastructure, Economic Productivity, Climate Resiliency",2013-12-08,"http://reliefweb.int/node/621597"
"621472","Sahel Crisis 2013: Funding status as of 06 December 2013",2013-12-06,"http://reliefweb.int/node/621472"
"621412","Humanitarian Implementation Plan (HIP) Mali (ECHO/MLI/BUD/2013/91000) Last update: 29/11/13 Version 4",2013-12-06,"http://reliefweb.int/node/621412"
"621243","Mali: Discovery of the mass grave of the ""Missing Red Berets""",2013-12-05,"http://reliefweb.int/node/621243"
"621044","Un bilan positif pour les élections présidentielles au Mali",2013-12-05,"http://reliefweb.int/node/621044"
"621042","La Suisse soutient les petits Tomboctiens affectés par la crise",2013-12-05,"http://reliefweb.int/node/621042"
"621039","ECOWAS Observer Mission adjudges Mali legislative polls acceptable, transparent",2013-12-05,"http://reliefweb.int/node/621039"
"620925","Mali must urgently identify bodies found in mass grave",2013-12-04,"http://reliefweb.int/node/620925"
"620900","UNICEF Mali Situation Report November 2013",2013-12-04,"http://reliefweb.int/node/620900"
"620876","La MINUSMA visite des détenus handicapés à la Maison Centrale d’Arrêt de Bamako",2013-12-04,"http://reliefweb.int/node/620876"
"620866","Mali : Aperçu Humanitaire (au 30 novembre 2013)",2013-12-04,"http://reliefweb.int/node/620866"
"620758","""La communauté internationale nous oblige à négocier avec un groupe armé"" (IBK)",2013-12-04,"http://reliefweb.int/node/620758"
"620753","AfDB Board approves US $55.27 million for project to improve food security in Mali",2013-12-04,"http://reliefweb.int/node/620753"
"620728","Mali : Rapport sur les mouvements internes de populations, 27 novembre 2013",2013-12-04,"http://reliefweb.int/node/620728"
"620725","Mali : Points de suivi des mouvements de populations - Flow monitoring points (FMP) du 24 au 30 Nov. 2013",2013-12-04,"http://reliefweb.int/node/620725"
"620723","Mali : Interventions des acteurs WASH interventions sur point d'eau et hygiene - Novembre 2013",2013-12-04,"http://reliefweb.int/node/620723"
"620653","Tombouctou : un projet d’aide de la MINUSMA aux agriculteurs affectés par la crise",2013-12-04,"http://reliefweb.int/node/620653"
"620708","Mali : CAP 2013 - Suivi des Financements (au 03 décembre 2013)",2013-12-03,"http://reliefweb.int/node/620708"
"620233","Desperate Situations Bring Back Old Malaria Interventions",2013-12-02,"http://reliefweb.int/node/620233"
"620205","Mali : 3W Présence opérationelle et programme - Qui fait, Quoi, Où (29 novembre 2013)",2013-12-02,"http://reliefweb.int/node/620205"
"620139","Nord du Mali: attentat-suicide et manifestation touareg, la violence persiste",2013-12-02,"http://reliefweb.int/node/620139"
"620088","West Africa Price Bulletin November 2013",2013-12-02,"http://reliefweb.int/node/620088"
"620071","Faire une évaluation rétrospéctive des forces et faiblesses de l'intervention de la CEDEAO au Mali",2013-12-02,"http://reliefweb.int/node/620071"
"620041","Mali - Cercle de Youwarou - Région de Mopti : Carte de référence (Novembre 2013)",2013-12-02,"http://reliefweb.int/node/620041"
"620040","Mali - Cercle de Tenenkou - Région de Mopti : Carte de référence (Novembre 2013)",2013-12-02,"http://reliefweb.int/node/620040"
"620038","Mali - Cercle de Koro - Région de Mopti : Carte de référence (Novembre 2013)",2013-12-02,"http://reliefweb.int/node/620038"
"620037","Mali - Cercle de Douentza - Région de Mopti : Carte de référence (Novembre 2013)",2013-12-02,"http://reliefweb.int/node/620037"
"620036","Mali - Cercle de Bankass - Région de Mopti : Carte de référence (Novembre 2013)",2013-12-02,"http://reliefweb.int/node/620036"
"620035","Mali - Cercle de Bandiagara - Région de Mopti : Carte de référence (Novembre 2013)",2013-12-02,"http://reliefweb.int/node/620035"
"620034","Mali - Cercle de Mopti - Région de Mopti : Carte de référence (Novembre 2013)",2013-12-02,"http://reliefweb.int/node/620034"
"620005","Afrique de l’Ouest Bulletin Mensuel des Prix Novembre 2013",2013-12-02,"http://reliefweb.int/node/620005"
"619854","An agenda for human rights in Mali",2013-12-01,"http://reliefweb.int/node/619854"
"620045","Mali : Education Cluster - Activités des partenaires décembre 2013, Année scolaire 2013-2014",2013-11-30,"http://reliefweb.int/node/620045"
"620001","Mali Mise à jour sur la sécurité alimentaire Novembre 2013",2013-11-30,"http://reliefweb.int/node/620001"
"619801","UN mission calls for restraint, return to negotiations after clash in Kidal",2013-11-30,"http://reliefweb.int/node/619801"
"619781","Tuaregs declare return to war against Mali army",2013-11-29,"http://reliefweb.int/node/619781"
"619757","Afrique de l’ouest : Perspectives de sécurité alimentaire octobre 2013 à mars 2014",2013-11-29,"http://reliefweb.int/node/619757"
"619729","Les rebelles touareg vont reprendre la guerre contre l'armée malienne",2013-11-29,"http://reliefweb.int/node/619729"
"619707","Sahel Crisis 2013: Funding status as of 29 November 2013",2013-11-29,"http://reliefweb.int/node/619707"
"619662","Mali - Cercle de Djenné - Région de Mopti : Carte de référence (Novembre 2013)",2013-11-29,"http://reliefweb.int/node/619662"
"619546","Tuaregs stop Mali PM visiting town",2013-11-29,"http://reliefweb.int/node/619546"
"619534","Access to health care remains challenging in the north",2013-11-28,"http://reliefweb.int/node/619534"
"619479","L'accès aux soins reste un défi dans le nord",2013-11-28,"http://reliefweb.int/node/619479"
"619460","Un petit enfant s’est remis à jouer, au moment où le PAM aide à reconstruire des vies dans le Nord du Mali",2013-11-28,"http://reliefweb.int/node/619460"
"619430","Situation au Mali : Refugiés et Personnes déplacées interne au Mali (20 novembre 2013)",2013-11-28,"http://reliefweb.int/node/619430"
"619385","Mali : Points de suivi des mouvements de populations - Flow monitoring points (FMP) du 17 au 23 Nov. 2013",2013-11-28,"http://reliefweb.int/node/619385"
"619283","Mali election to enter second round on Dec 15: official - Lead",2013-11-28,"http://reliefweb.int/node/619283"
"619266","Mali/législatives: aucune majorité au 1er tour, second tour le 15 décembre (officiel)",2013-11-27,"http://reliefweb.int/node/619266"
"619233","Humanitarian actors in the Sahel start work on a three-year response plan",2013-11-27,"http://reliefweb.int/node/619233"
"619229","Les acteurs humanitaires au Sahel travaillent sur un plan de réponse triennal",2013-11-27,"http://reliefweb.int/node/619229"
"619112","L'insécurité règne encore dans le nord du Mali et freine l'aide humanitaire",2013-11-27,"http://reliefweb.int/node/619112"
"619071","La mission d’observation éléctorale de la CEDEAO juge les législatives maliennes acceptables et transparentes",2013-11-27,"http://reliefweb.int/node/619071"
"618874","Avis sur les résultats préliminaires de la campagne agricole 2013-2014 au Sahel et en Afrique de l’Ouest",2013-11-26,"http://reliefweb.int/node/618874"
"618870","Little Boy Plays Again As WFP Works To Rebuild Lives In Northern Mali",2013-11-26,"http://reliefweb.int/node/618870"
"618852","Preliminary results of the 2013-2014 agricultural campaign in the Sahel and West Africa",2013-11-26,"http://reliefweb.int/node/618852"
"618776","Insecurity still engulfs northern Mali, hampering humanitarian effort",2013-11-26,"http://reliefweb.int/node/618776"
"618695","US, EU hail successful parliamentary polls in Mali",2013-11-26,"http://reliefweb.int/node/618695"
"618653","Soulagement après des législatives sans violence jihadiste",2013-11-26,"http://reliefweb.int/node/618653"
"618467","Mali: soulagement après des législatives sans violence jihadiste",2013-11-25,"http://reliefweb.int/node/618467"
"618434","L’Union africaine observera les élections législatives au Mali",2013-11-25,"http://reliefweb.int/node/618434"
"618397","La crise humanitaire se poursuit au Mali, loin des projecteurs",2013-11-25,"http://reliefweb.int/node/618397"
"618363","Sahel and West Africa: Assumptions for Quarterly Food Security Analysis -  October 2013",2013-11-25,"http://reliefweb.int/node/618363"
"618358","ECOWAS lauded for its immense support, solidarity with Mali",2013-11-25,"http://reliefweb.int/node/618358"
"618355","Mali Food Security Outlook October 2013 to March 2014",2013-11-25,"http://reliefweb.int/node/618355"
"618341","World Bank funding to boost drinking water supply in Bamako",2013-11-25,"http://reliefweb.int/node/618341"
"618301","Mali parliamentary polls marked by apathy, minor unrest",2013-11-25,"http://reliefweb.int/node/618301"
"618296","Tuareg protesters prevent voting in northern Mali town",2013-11-24,"http://reliefweb.int/node/618296"
"618286","Malians vote amid security fears",2013-11-24,"http://reliefweb.int/node/618286"
"618279","Les Maliens ont voté pour leurs députés dans le calme, mais sans ferveur",2013-11-24,"http://reliefweb.int/node/618279"
"618275","Législatives au Mali: des hommes armés enlèvent une urne d'un bureau dans le Nord",2013-11-24,"http://reliefweb.int/node/618275"
"618174","Fears over election security in Mali rebel stronghold",2013-11-23,"http://reliefweb.int/node/618174"
"618133","Elections législatives: la MINUSMA réactive son centre d'appel",2013-11-22,"http://reliefweb.int/node/618133"
"618072","Sahel Crisis 2013: Funding status as of 22 November 2013",2013-11-22,"http://reliefweb.int/node/618072"
"618012","Head of ECOWAS Observer Mission appeals for peaceful legislative election in Mali",2013-11-22,"http://reliefweb.int/node/618012"
"617903","Out of spotlight, humanitarian crisis continues in Mali",2013-11-22,"http://reliefweb.int/node/617903"
"617869","Mali votes in lawmakers to complete return to democracy",2013-11-22,"http://reliefweb.int/node/617869"
"617794","Prévenir la malnutrition infantile au Mali avec des distributions de compléments alimentaires",2013-11-21,"http://reliefweb.int/node/617794"
"617688","100 ECOWAS observers for Mali parliamentary election",2013-11-21,"http://reliefweb.int/node/617688"
