"data.list.id","title","date.created","rw.url"
"606465","UNICEF Mali Situation Report, September 2013",2013-10-03,"http://reliefweb.int/node/606465"
"606441","23 prisonniers libérés dans le cadre de l'accord Bamako-groupes armés",2013-10-02,"http://reliefweb.int/node/606441"
"606440","Mali frees 23 prisoners as part of stalled rebel deal",2013-10-02,"http://reliefweb.int/node/606440"
"606403","Assistance à un demi-million de personnes confrontées à un regain de violence dans le nord du pays",2013-10-02,"http://reliefweb.int/node/606403"
"606377","Aid for half a million people in north of country",2013-10-02,"http://reliefweb.int/node/606377"
"606276","CEDEAO : lancement de l’agence régionale pour l’agriculture et l’alimentation à Lomé",2013-10-02,"http://reliefweb.int/node/606276"
"606149","Amadou's second chance",2013-10-01,"http://reliefweb.int/node/606149"
"605927","Mali Mise à jour sur la sécurité alimentaire septembre 2013",2013-10-01,"http://reliefweb.int/node/605927"
"605892","West Africa Price Bulletin September 2013",2013-10-01,"http://reliefweb.int/node/605892"
"605891","Afrique de l’Ouest Bulletin Mensuel des Prix Septembre 2013",2013-10-01,"http://reliefweb.int/node/605891"
"605886","Sahel and West Africa Food Security Update August 2013",2013-10-01,"http://reliefweb.int/node/605886"
"605860","West Africa Seasonal Monitor September 2013",2013-10-01,"http://reliefweb.int/node/605860"
"605800","Mali : 3W Présence opérationelle et programme - Qui fait, Quoi, Où (30 septembre 2013)",2013-09-30,"http://reliefweb.int/node/605800"
"605798","Situation Update: The Sahel Crisis - 30 September 2013",2013-09-30,"http://reliefweb.int/node/605798"
"606267","Mali : Points de suivi des mouvements de populations - Flow monitoring points (FMP) du 22 au 28 Septembre 2013",2013-09-30,"http://reliefweb.int/node/606267"
"605733","A peine sorti de la crise, le Mali en proie à de nouveaux troubles",2013-09-30,"http://reliefweb.int/node/605733"
"605723","Sécurité alimentaire et implications humanitaires en Afrique de l’Ouest et au Sahel - septembre 2013",2013-09-30,"http://reliefweb.int/node/605723"
"605699","Fresh fighting in Mali rebel stronghold",2013-09-30,"http://reliefweb.int/node/605699"
"605672","La Suisse vient au secours des familles victimes des inondations à Bamako",2013-09-30,"http://reliefweb.int/node/605672"
"605671","La Radio Kledu contribue à la réussite des élections au Mali",2013-09-30,"http://reliefweb.int/node/605671"
"606071","Mali : Aperçu humanitaire (au 30 septembre 2013)",2013-09-30,"http://reliefweb.int/node/606071"
"605527","Le Mali sous pression après de nouvelles violences dans le Nord",2013-09-30,"http://reliefweb.int/node/605527"
"605483","UN officials speak out against attack targeting Malian armed forces",2013-09-29,"http://reliefweb.int/node/605483"
"605452","Deux civils tués dans une attaque suicide contre l'armée à Tombouctou",2013-09-28,"http://reliefweb.int/node/605452"
"605451","Suicide bombers kill Malian civilians in upsurge in violence",2013-09-28,"http://reliefweb.int/node/605451"
"605402","Situation Update: The Sahel Crisis - 27 September 2013",2013-09-27,"http://reliefweb.int/node/605402"
"605367","Le Président du Mali affirme que son pays est prêt à reprendre sa place dans le concert des Nations",2013-09-27,"http://reliefweb.int/node/605367"
"605355","Mali Bulletin des Prix - septembre 2013",1970-01-16,"http://reliefweb.int/node/605355"
"605331","Mali Price Bulletin September 2013",2013-09-27,"http://reliefweb.int/node/605331"
"605290","Sahel Crisis 2013: Funding status as of 27 September 2013",2013-09-27,"http://reliefweb.int/node/605290"
"605150","Mobilisation de l'ONU pour mettre en œuvre la Stratégie intégrée pour le Sahel",2013-09-27,"http://reliefweb.int/node/605150"
"605142","Mali rebels suspend talks with government: statement",2013-09-27,"http://reliefweb.int/node/605142"
"605138","Les rébellions touareg et arabe suspendent les négociations avec Bamako",2013-09-27,"http://reliefweb.int/node/605138"
"605094","La MINUSMA salue la libération de 30 détenus par le MNLA à Kidal",2013-09-26,"http://reliefweb.int/node/605094"
"605093","Efforts in Africa’s Sahel must tackle humanitarian, security needs to ensure peace – Ban",2013-09-26,"http://reliefweb.int/node/605093"
"604678","Mali: CAP 2013 - Suivi des Financements (au 25 septembre 2013)",2013-09-25,"http://reliefweb.int/node/604678"
"604634","Une approche pratique de la résilience",2013-09-25,"http://reliefweb.int/node/604634"
"604586","Enquête nutritionnelle anthropométrique et de mortalité rétrospective dans les 4 districts sanitaires de la région de Gao : protocole basé sur la méthodologie SMART - Rapport Final, Juin 2013",2013-09-25,"http://reliefweb.int/node/604586"
"501344","Mali: Location Map (2013)",2013-09-25,"http://reliefweb.int/node/501344"
"604433","Critical Health Services Reach Underserved Communities in Northern Mali",2013-09-24,"http://reliefweb.int/node/604433"
"604415","A practical approach to resilience",2013-09-24,"http://reliefweb.int/node/604415"
"604409","UNW Mali Humanitarian bulletin 24-28 July 2013",2013-09-24,"http://reliefweb.int/node/604409"
"604390","Catalogue de cartes de référence du Mali (septembre 2013)",2013-09-24,"http://reliefweb.int/node/604390"
"606020","Mali: Points de suivi des mouvements de populations - Flow monitoring points (FMP) du 15 au 21 Septembre 2013",2013-09-24,"http://reliefweb.int/node/606020"
"604278","ECHO Factsheet – Resilience in the Sahel – September, 2013",2013-09-24,"http://reliefweb.int/node/604278"
"604231","Allégations de mauvaise conduite portées contre des Casques bleus de la MINUSMA",1970-01-16,"http://reliefweb.int/node/604231"
"604227","Serious misconduct, sexual abuse alleged against UN peacekeepers in Mali",2013-09-24,"http://reliefweb.int/node/604227"
"604168","Décision de la commission du 13.9.2013 relative au financement d'actions humanitaires au Mali sur le 10e Fonds européen de développement (FED) (ECHO/MLI/EDF/2013/01000)",2013-09-24,"http://reliefweb.int/node/604168"
"604167","Commission decision of 13.9.2013 financing humanitarian actions in Mali from the 10th European Development Fund (EDF) (ECHO/MLI/EDF/2013/01000)",2013-09-24,"http://reliefweb.int/node/604167"
"604044","Avis sur les perspectives agricole et alimentaires au Sahel et en Afrique de l'Ouest",2013-09-23,"http://reliefweb.int/node/604044"
"603982","FAO and WFP appeal for immediate support for Northern Mali",2013-09-23,"http://reliefweb.int/node/603982"
"603975","La FAO et le PAM demandent un soutien immédiat pour le Nord du Mali",2013-09-23,"http://reliefweb.int/node/603975"
"603830","Après la crise, ""le Mali est debout et en ordre de marche"" (président Keïta)",2013-09-23,"http://reliefweb.int/node/603830"
"603724","La réduction des effectifs français au Mali dépendra des législatives (entourage Hollande)",2013-09-20,"http://reliefweb.int/node/603724"
"603537","World Bank and Mali Sign $US 50 Million Agreement to Protect Poor Malians and Boost the Country’s Recovery from Crisis",2013-09-20,"http://reliefweb.int/node/603537"
"603667","Sahel Crisis 2013: Funding status as of 20 September 2013",2013-09-20,"http://reliefweb.int/node/603667"
"603504","La Banque mondiale et le Mali signent un accord de crédit de 50 millions de dollars EU pour aider le pays à se reconstruire",2013-09-20,"http://reliefweb.int/node/603504"
"603474","Le Mali célèbre son nouveau président et salue ses soutiens durant la crise",2013-09-20,"http://reliefweb.int/node/603474"
"603455","Mali president inaugurated in front of thousands",2013-09-19,"http://reliefweb.int/node/603455"
"603401","Neighbourhoods emptied by rising flood waters",2013-09-19,"http://reliefweb.int/node/603401"
"603377","Life after occupation - in pictures",2013-09-19,"http://reliefweb.int/node/603377"
"603369","Hard start for Mali's new leader",2013-09-19,"http://reliefweb.int/node/603369"
"603144","Building Explosive Disposal Capacity in Mali",2013-09-18,"http://reliefweb.int/node/603144"
"603131","Mali Situation Update n° 20  June & July 2013",2013-09-18,"http://reliefweb.int/node/603131"
"603115","Mali calls parliamentary elections for November 24",2013-09-18,"http://reliefweb.int/node/603115"
"603060","Armed groups in northern Mali commit to peace talks",2013-09-18,"http://reliefweb.int/node/603060"
"603050","Mali: des groupes armés prêts pour ""la résolution définitive de la crise"" (déclaration)",2013-09-18,"http://reliefweb.int/node/603050"
"603043","Décision de la Commission du 13.9.2013 relative au financement d'actions humanitaires au Mali sur le 10e Fonds européen de développement (FED) (ECHO/MLI/EDF/2013/01000)",2013-09-18,"http://reliefweb.int/node/603043"
"603042","Commission decision of 13.9.2013 financing humanitarian actions in Mali from the 10th European Development Fund (EDF) (ECHO/MLI/EDF/2013/01000)",2013-09-18,"http://reliefweb.int/node/603042"
"603040","Rapport sur la création d’un marché au camp de refugiés à Abala",2013-09-18,"http://reliefweb.int/node/603040"
"603020","Déminage au Mali : Des anciens rebelles nigériens exhortent le Mali à s'inspirer de leur succès",2013-09-18,"http://reliefweb.int/node/603020"
"602999","Mali - Région de Gao : Carte de référence (Septembre 2013)",2013-09-18,"http://reliefweb.int/node/602999"
"602998","Mali - Région de Tombouctou : Carte de référence (Septembre 2013)",2013-09-18,"http://reliefweb.int/node/602998"
"602997","Mali - Région de Mopti : Carte de référence (Septembre 2013)",2013-09-18,"http://reliefweb.int/node/602997"
"602995","Mali - Région de Ségou : Carte de référence (Septembre 2013)",2013-09-18,"http://reliefweb.int/node/602995"
"602994","Mali - Région de Sikasso : Carte de référence (Septembre 2013)",2013-09-18,"http://reliefweb.int/node/602994"
"602993","Mali - Région de Koulikoro : Carte de référence (Septembre 2013)",2013-09-18,"http://reliefweb.int/node/602993"
"602990","Mali - Région de Kayes : Carte de référence (Septembre 2013)",2013-09-18,"http://reliefweb.int/node/602990"
"602988","Mali - Région de Kidal : Carte de référence (Septembre 2013)",2013-09-18,"http://reliefweb.int/node/602988"
"602966","Afrique de l’ouest : des États examinent la mise en œuvre du droit international humanitaire",2013-09-18,"http://reliefweb.int/node/602966"
"602965","Mise en ligne du site internet dédié à la transparence française au Mali (18 septembre 2013)",2013-09-18,"http://reliefweb.int/node/602965"
"602875","Le gouvernement confirme les législatives en novembre/décembre",2013-09-17,"http://reliefweb.int/node/602875"
"602817","La mission de l'UE doit être prolongée (commandant)",2013-09-17,"http://reliefweb.int/node/602817"
"602739","Mali back-to-school campaign faces uphill struggle",2013-09-17,"http://reliefweb.int/node/602739"
"602552","Le chef de la MINUSMA lance un appel au calme après un incident à Kidal",2013-09-16,"http://reliefweb.int/node/602552"
"602498","Apply Niger demining lessons in Mali, Niger's ex-rebels urge",2013-09-16,"http://reliefweb.int/node/602498"
"602460","SOSDémocratie prépare les citoyens maliens à voter dans les meilleures conditions",2013-09-16,"http://reliefweb.int/node/602460"
"602183","Mali: un programme de «Vivres Contre Travail» du PAM aide les agriculteurs à diversifier leur production",2013-09-13,"http://reliefweb.int/node/602183"
"602039","Sahel Crisis 2013: Funding status as of 13 September 2013",2013-09-13,"http://reliefweb.int/node/602039"
"601947","Mali: Plus de 18 mois sans ecole pour les enfants de Kidal",2013-09-13,"http://reliefweb.int/node/601947"
"601903","Bulletin de suivi de la campagne agropastorale au Sahel et en Afrique de l’Ouest – Août 2013, Volume 23, N° 05",2013-09-12,"http://reliefweb.int/node/601903"
"601866","La rébellion touareg dénonce une ""attaque"" de l'armée",2013-09-12,"http://reliefweb.int/node/601866"
"601806","Malian troops in first clash with MNLA rebels since truce",2013-09-12,"http://reliefweb.int/node/601806"
"601794","Mali : Situation dans la Commune IV après les inondations du 28/08/2013 (au 05 septembre 2013)",2013-09-12,"http://reliefweb.int/node/601794"
"601790","Mali : Situation dans la Commune I, après les inondations du 28/08/2013 (au 05 septembre 2013)",2013-09-12,"http://reliefweb.int/node/601790"
"601787","More than 500,000 refugees from northern Mali still cannot return",2013-09-12,"http://reliefweb.int/node/601787"
"601770","Situation du cholera au Mali : Cluster Wash - entre 2003 et 2013 (05 août 2013)",2013-09-12,"http://reliefweb.int/node/601770"
"601765","Mali - Région de Ségou et Mopti : Evaluation rapide post inondation - Août 2013",2013-09-12,"http://reliefweb.int/node/601765"
"601750","L’OIM au Mali poursuit ses efforts face aux inondations",2013-09-12,"http://reliefweb.int/node/601750"
"601499","Food-For-Work Helps Farmers Diversify Their Production",2013-09-11,"http://reliefweb.int/node/601499"
"601446","Sierra Leone donates $ 1 Million to AU Trust Fund on Mali",2013-09-11,"http://reliefweb.int/node/601446"
"601163","U.S. Lifts Restrictions on Bilateral Assistance to Mali",2013-09-10,"http://reliefweb.int/node/601163"
"601149","Kids Head Back To School In Timbuktu",2013-09-10,"http://reliefweb.int/node/601149"
"601057","La rébellion touareg appelle le nouveau gouvernement à oeuvrer pour la paix",2013-09-10,"http://reliefweb.int/node/601057"
"601043","Des ""assises nationales du Nord"" pour bientôt (président Keïta)",2013-09-09,"http://reliefweb.int/node/601043"
"601006","Cinzana : Sécurité alimentaire retrouvée grâce à une meilleure planification",2013-09-09,"http://reliefweb.int/node/601006"
"600990","Sahel Crisis 2013: Funding status as of  6 September 2013",2013-09-09,"http://reliefweb.int/node/600990"
"600957","Tombouctou : plus de repas égale plus de filles à l’école",2013-09-09,"http://reliefweb.int/node/600957"
"600806","La MINUSMA prend acte de la formation d'un nouveau gouvernement au Mali",2013-09-09,"http://reliefweb.int/node/600806"
"600803","Mali announces first post-war government",2013-09-09,"http://reliefweb.int/node/600803"
"600785","Le nouveau gouvernement formé, un ministère chargé de la Réconciliation",2013-09-08,"http://reliefweb.int/node/600785"
"600776","Les Etats-Unis annoncent la reprise de leur aide au Mali, suspendue après le coup",2013-09-08,"http://reliefweb.int/node/600776"
"601145","Mali : Points de suivi des mouvements de populations (du 02 au 08 Septembre 2013)",2013-09-08,"http://reliefweb.int/node/601145"
"600745","UN peacekeeping mission in Mali notes formation of new Government",2013-09-08,"http://reliefweb.int/node/600745"
"600723","IOM Mali continues flood relief effort",2013-09-07,"http://reliefweb.int/node/600723"
"600676","Le nouveau Premier ministre Ly consulte pour former son gouvernement",2013-09-06,"http://reliefweb.int/node/600676"
"600668","Mali - Carte de référence (Septembre 2013)",2013-09-06,"http://reliefweb.int/node/600668"
"600666","Mali - Régions et Districts sanitaires (Septembre 2013)",2013-09-06,"http://reliefweb.int/node/600666"
"600605","Mali: Repartition de la population par cercle (au 30 août 2013)",2013-09-06,"http://reliefweb.int/node/600605"
"600574","Intentions de retour des personnes déplacées à Bamako - août 2013",2013-09-06,"http://reliefweb.int/node/600574"
"600542","Food security and humanitarian implications in West Africa and the Sahel - August 2013",2013-09-06,"http://reliefweb.int/node/600542"
"600623","Africa – ECHO Flash Events (as of 6 September 2013)",2013-09-06,"http://reliefweb.int/node/600623"
"600437","Banker Oumar Tatam Ly appointed Mali premier: decree",2013-09-05,"http://reliefweb.int/node/600437"
"600433","Oumar Tatam Ly, premier chef de gouvernement du Mali post-crise",2013-09-05,"http://reliefweb.int/node/600433"
"604561","Mali: Situation des cantines scolaires au Nord : Cluster Education - Septembre 2013",2013-09-05,"http://reliefweb.int/node/604561"
"600220","Faire du porte à porte pour ramener les enfants à l'école",2013-09-05,"http://reliefweb.int/node/600220"
"600159","Mali : Aperçu sur les inondations à Bamako (au 3 septembre 2013)",2013-09-04,"http://reliefweb.int/node/600159"
"600119","Les transferts monétaires du PAM apportent un nouvel espoir aux déplacés et les familles-hôtes",2013-09-04,"http://reliefweb.int/node/600119"
"600076","West and Central Africa: Election calendar (as of 4 September 2013)",2013-09-04,"http://reliefweb.int/node/600076"
"600052","Investi président du Mali, Keïta met la réconciliation au coeur de son mandat",2013-09-04,"http://reliefweb.int/node/600052"
"600015","Mali's new leader vows to unite divided nation",2013-09-04,"http://reliefweb.int/node/600015"
"599961","Food security situation in the Sahel remains dire",2013-09-04,"http://reliefweb.int/node/599961"
"599960","La situation de la sécurité alimentaire au Sahel reste précaire",2013-09-04,"http://reliefweb.int/node/599960"
"599926","Mali Food Security Update August 2013",2013-09-04,"http://reliefweb.int/node/599926"
"599907","Going door to door to get children back to school",2013-09-04,"http://reliefweb.int/node/599907"
"599893","Le nouveau gouvernement à la croisée des chemins",2013-09-04,"http://reliefweb.int/node/599893"
"599877","New Government at Crossroads",2013-09-03,"http://reliefweb.int/node/599877"
"599863","L’UNICEF se prépare à aider plus de 500 000 enfants maliens à retourner à l’école",2013-09-03,"http://reliefweb.int/node/599863"
"599853","Timbuktu: More Food Means More Girls In School",2013-09-03,"http://reliefweb.int/node/599853"
"599852","UNICEF gears up to help over 500,000 Malian children return to school",2013-09-03,"http://reliefweb.int/node/599852"
"599844","Sahel Humanitarian Dashboard (as of 30 August 2013)",2013-09-03,"http://reliefweb.int/node/599844"
"599831","Sécurité alimentaire et implications humanitaires en Afrique de l’Ouest et au Sahel - août 2013",2013-09-03,"http://reliefweb.int/node/599831"
"599750","Pendant le mois de juillet, le CICR en collaboration avec la Croix-Rouge malienne",2013-09-03,"http://reliefweb.int/node/599750"
"599718","IOM responds to floods in Mali",2013-09-03,"http://reliefweb.int/node/599718"
"600215","L'OIM fait face à une crise liée aux inondations à Bamako, au Mali",2013-09-03,"http://reliefweb.int/node/600215"
"599472","Visite du Représentant spécial adjoint dans les zones sinistrées par les inondations à Bamako",2013-09-02,"http://reliefweb.int/node/599472"
"599432","KOFF Newsletter No. 120 - Mali",2013-09-02,"http://reliefweb.int/node/599432"
"599378","Sahel et Afrique de l’Ouest - Mise à jour de la Perspective sur la sécurité alimentaire, Août 2013",2013-09-02,"http://reliefweb.int/node/599378"
"599349","UNICEF Mali Situation Report, August 2013",2013-09-02,"http://reliefweb.int/node/599349"
"599285","USG Humanitarian assistance in the Sahel (as of 30 August 2013)",2013-08-30,"http://reliefweb.int/node/599285"
"599284","Sahel Food Insecurity and Complex Emergency - Fact Sheet #5 (FY) 2013",2013-08-30,"http://reliefweb.int/node/599284"
"599252","Mali : Aperçu humanitaire (au 30 août 2013)",2013-08-30,"http://reliefweb.int/node/599252"
"599249","Mali: Flood locations within the Cercles of Niono and Tessalit (as of 23 August 2013)",2013-08-30,"http://reliefweb.int/node/599249"
"599233","Appui aux sinistrés des inondations à Bamako",2013-08-30,"http://reliefweb.int/node/599233"
"599226","Mali : 3W Présence opérationelle et programme - Qui fait, Quoi, Où (30 août 2013)",2013-08-30,"http://reliefweb.int/node/599226"
"599216","Red Cross responds as severe flooding takes its toll in the Sahel",2013-08-30,"http://reliefweb.int/node/599216"
"599208","At least 34 dead in floods in Mali capital: rescuers",2013-08-30,"http://reliefweb.int/node/599208"
"599190","En attendant la pluie",2013-08-30,"http://reliefweb.int/node/599190"
"599186","34 morts dans les inondations à Bamako (nouveau bilan)",2013-08-30,"http://reliefweb.int/node/599186"
"598939","Mali: après des pluies torrentielles, inondations meurtrières à Bamako",2013-08-30,"http://reliefweb.int/node/598939"
"598774","At least 23 dead in floods in Mali capital: government",2013-08-29,"http://reliefweb.int/node/598774"
"598755","Mali Mise à jour sur la sécurité alimentaire Août 2013",2013-08-29,"http://reliefweb.int/node/598755"
"598347","Mali: CAP 2013 - Suivi des Financements (au 27 Août 2013)",2013-08-27,"http://reliefweb.int/node/598347"
"598221","Mali Price Bulletin August 2013",2013-08-26,"http://reliefweb.int/node/598221"
"598218","West Africa Price Bulletin August 2013",2013-08-26,"http://reliefweb.int/node/598218"
"598197","Afrique de l’Ouest Bulletin Mensuel des Prix - août 2013",2013-08-26,"http://reliefweb.int/node/598197"
"598145","Mali Bulletin des Prix - août 2013",2013-08-26,"http://reliefweb.int/node/598145"
"598127","Situation Update: The Sahel Crisis - 27 August 2013",2013-08-26,"http://reliefweb.int/node/598127"
"598308","Mali: urgence complexe Rapport de situation no 39 (26 août 2013)",2013-08-26,"http://reliefweb.int/node/598308"
"598307","Mali: Complex Emergency Situation Report No. 39 (26 August 2013)",2013-08-26,"http://reliefweb.int/node/598307"
"601487","Face aux inondations, ACTED réagit",2013-08-25,"http://reliefweb.int/node/601487"
"597857","UN Mission in Haiti sends start-up equipment to new Mali mission",2013-08-25,"http://reliefweb.int/node/597857"
"597845","Insight -UN's Mali task is state-building as much as peacekeeping",2013-08-25,"http://reliefweb.int/node/597845"
"597676","Mali – Floods (ECHO Daily Flash 23/08/2013)",2013-08-23,"http://reliefweb.int/node/597676"
"597510","Ban pledges UN support to Malian President-elect’s efforts to advance peace, stability",2013-08-23,"http://reliefweb.int/node/597510"
"597413","WFP Cash Transfer In Mali: New Hope For Displaced People And Host Families",2013-08-22,"http://reliefweb.int/node/597413"
"597411","Waiting For The Rain",2013-08-22,"http://reliefweb.int/node/597411"
"597374","Le Mali attire les fonctionnaires dans le Nord avec des incitations financières",2013-08-22,"http://reliefweb.int/node/597374"
"597361","Sahel : le formidable outil de l'hydrologie isotopique pour détecter les sources d'eau souterraines",2013-08-22,"http://reliefweb.int/node/597361"
"597201","Les femmes du Mali s’engagent pour la paix",2013-08-21,"http://reliefweb.int/node/597201"
"597137","Questions raised around IDP participation in elections in Mali",1970-01-16,"http://reliefweb.int/node/597137"
"597120","West Africa Seasonal Monitor August 21, 2013",2013-08-21,"http://reliefweb.int/node/597120"
"597056","Mali lures civil servants to the north with cash",2013-08-21,"http://reliefweb.int/node/597056"
"597039","Sensibilisation aux soldats maliens en questions humanitaires: l´expérience d´un formateur",2013-08-21,"http://reliefweb.int/node/597039"
"596857","Le CICR au Mali",2013-08-20,"http://reliefweb.int/node/596857"
"596856","Building respect for humanitarian principles in Mali",2013-08-20,"http://reliefweb.int/node/596856"
"596802","Mali+3 Regional Humanitarian Snapshot (Mid-Year Review 2013)",2013-08-20,"http://reliefweb.int/node/596802"
"596421","Le Conseil de sécurité salue le bon déroulement de l'élection présidentielle au Mali",2013-08-19,"http://reliefweb.int/node/596421"
"596333","Security Council Press Statement on Mali",2013-08-18,"http://reliefweb.int/node/596333"
"596182","Sahel Crisis 2013: Funding status as of 16 August 2013",2013-08-16,"http://reliefweb.int/node/596182"
"596057","Malian Officials Train to Better Protect Children Caught Up in Crisis",2013-08-16,"http://reliefweb.int/node/596057"
"596047","Preparing Youth for Employment",2013-08-16,"http://reliefweb.int/node/596047"
"595983","Le Secrétaire général félicite le Président élu Ibrahim Boubacar Keїta",2013-08-16,"http://reliefweb.int/node/595983"
"603622","Mali: Situation des écoles fonctionnelles au nord en mai 2013 - Cluster Education, août 2013",2013-08-16,"http://reliefweb.int/node/603622"
"595960","Ban congratulates Malians, and president-elect Keita, on successful polls",2013-08-15,"http://reliefweb.int/node/595960"
"595858","Score écrasant de 77,6% pour le nouveau président IB Keïta",2013-08-15,"http://reliefweb.int/node/595858"
"595726","Mali : 3W Présence opérationelle et programme - Qui fait, Quoi, Où (31 juillet 2013)",2013-08-14,"http://reliefweb.int/node/595726"
"595622","La peur des rebelles hante encore les éleveurs maliens",2013-08-14,"http://reliefweb.int/node/595622"
"595604","Mali's fish traders get wise to wetland conservation",2013-08-14,"http://reliefweb.int/node/595604"
"595559","Des militaires non armés suisses en mission au Mali",2013-08-14,"http://reliefweb.int/node/595559"
"595554","Swiss mission of unarmed military personnel to Mali",2013-08-14,"http://reliefweb.int/node/595554"
"595551","Le second tour de la présidentielle malienne s’est déroulé dans le calme et la transparence, estime la CEDEAO",2013-08-14,"http://reliefweb.int/node/595551"
"595469","La rébellion touareg félicite IBK pour sa ""brillante victoire""",2013-08-14,"http://reliefweb.int/node/595469"
"595448","What next for Mali’s post-election leadership?",2013-08-13,"http://reliefweb.int/node/595448"
"595402","Fear of rebels still haunts Mali's herders",2013-08-13,"http://reliefweb.int/node/595402"
"595377","Réussir la transition au Mali",2013-08-13,"http://reliefweb.int/node/595377"
"595338","Redresser le Mali, rude mission pour le futur président Keïta",2013-08-13,"http://reliefweb.int/node/595338"
"595325","Keita set to reunite Mali after poll rival concedes defeat",2013-08-13,"http://reliefweb.int/node/595325"
