"data.list.id","title","date.created","rw.url"
"617681","Sahel Humanitarian Dashboard (as of 12 November 2013)",2013-11-21,"http://reliefweb.int/node/617681"
"617679","Evaluation provisoire de la situation alimentaire du pays campagne agricole 2013-2014",2013-11-21,"http://reliefweb.int/node/617679"
"617652","Rockets fired in Mali's northern city of Gao",2013-11-21,"http://reliefweb.int/node/617652"
"617613","Législatives au Mali pour tenter de sortir enfin définitivement du chaos",2013-11-21,"http://reliefweb.int/node/617613"
"617607","Mali - Cercle de Niafunké - Région de Tombouctou : Carte de référence (Octobre 2013)",2013-11-21,"http://reliefweb.int/node/617607"
"617604","Mali - Cercle de Gourma Rharous - Région de Tombouctou : Carte de référence (Octobre 2013)",2013-11-21,"http://reliefweb.int/node/617604"
"617601","Mali - Cercle de Diré - Région de Tombouctou : Carte de référence (Octobre 2013 )",2013-11-21,"http://reliefweb.int/node/617601"
"617599","Mali - Cercle de Goundam - Région de Tombouctou : Carte de référence (Octobre 2013)",2013-11-21,"http://reliefweb.int/node/617599"
"617597","Mali - Cercle de Tombouctou - Région de Tombouctou: Carte de référence (Octobre 2013)",2013-11-21,"http://reliefweb.int/node/617597"
"617545","Hidden and in Need: Urban Displacement in Southern Mali",2013-11-21,"http://reliefweb.int/node/617545"
"617240","Inspiring Light amidst the Darkness of War",2013-11-20,"http://reliefweb.int/node/617240"
"617177","Le partenariat pour la responsabilité sociale lancé",2013-11-20,"http://reliefweb.int/node/617177"
"617169","L’école est paralysée dans le nord du Mali, constate une mission conjointe de l’UNESCO et du gouvernement malien",2013-11-20,"http://reliefweb.int/node/617169"
"617086","Mali: Humanitarian Bulletin, October 2013",1970-01-17,"http://reliefweb.int/node/617086"
"617085","Mali Bulletin humanitaire, octobre 2013",2013-11-19,"http://reliefweb.int/node/617085"
"617068","West and Central Africa Humanitarian Bulletin November 2013",2013-11-19,"http://reliefweb.int/node/617068"
"617030","Schools in northern Mali are barely functioning, concludes mission by UNESCO and Government of Mali",2013-11-19,"http://reliefweb.int/node/617030"
"616941","ECOWAS steps up humanitarian assistance to Mali",2013-11-19,"http://reliefweb.int/node/616941"
"616743","Vingt spécialistes de la CEDEAO dans le domaine humanitaire déployés pour appuyer les efforts de réhabilitation au Mali",2013-11-18,"http://reliefweb.int/node/616743"
"630740","Point sur la situation alimentaire au Sahel - Suivi de campagne n°151 - début novembre 2013",2013-11-18,"http://reliefweb.int/node/630740"
"616411","France to help train mali police: minister",2013-11-17,"http://reliefweb.int/node/616411"
"616058","Sahel Crisis 2013: Funding status as of 15 November 2013",2013-11-15,"http://reliefweb.int/node/616058"
"615814","Maghreb/Sahel: les Etats s'engagent à renforcer leur coopération sécuritaire",2013-11-14,"http://reliefweb.int/node/615814"
"615811","Sahel states seek to boost security against jihadists",2013-11-14,"http://reliefweb.int/node/615811"
"615786","Easing UXO dangers in Mali",2013-11-14,"http://reliefweb.int/node/615786"
"615545","Mali : Points de suivi des mouvements de populations - Flow monitoring points (FMP) du 03 au 09 nov. 2013",2013-11-13,"http://reliefweb.int/node/615545"
"615252","Mali Price Bulletin November 2013",2013-11-13,"http://reliefweb.int/node/615252"
"615222","Mali Bulletin des Prix novembre 2013",2013-11-12,"http://reliefweb.int/node/615222"
"614974","UN Women Executive Director reinforces role of women as agents of peace and development in Sahel region on visit led by UN Secretary-General",2013-11-12,"http://reliefweb.int/node/614974"
"614649","The AfDB to grant $4 billion to the Sahel for stability and economic growth",2013-11-11,"http://reliefweb.int/node/614649"
"614590","Troubled Mali confident key polls can be held",2013-11-11,"http://reliefweb.int/node/614590"
"614587","""Bon espoir"" pour des législatives en dépit de l'insécurité (ministre)",2013-11-11,"http://reliefweb.int/node/614587"
"614403","Army and militants clash in conflict-scarred Mali",2013-11-08,"http://reliefweb.int/node/614403"
"614397","Mali: accrochage entre soldats maliens et ""bandits armés"" dans le Nord, 3 tués (Défense)",2013-11-08,"http://reliefweb.int/node/614397"
"614364","Mali Situation Overview October 2013",2013-11-08,"http://reliefweb.int/node/614364"
"614323","Food security and humanitarian implications in West Africa and the Sahel - October 2013",2013-11-08,"http://reliefweb.int/node/614323"
"614296","Sahel Crisis 2013: Funding status as of 08 November 2013",2013-11-08,"http://reliefweb.int/node/614296"
"614011","L'Union européenne poursuit son engagement en faveur du Mali",2013-11-07,"http://reliefweb.int/node/614011"
"613954","Le nombre de déplacés internes chute au Mali passant à 283 000 individus",2013-11-07,"http://reliefweb.int/node/613954"
"613952","Mali - Sous-Cluster Protection de l’Enfance (SCPE) : Tableau de bord sur les besoins, la réponse et les lacunes à combler en Protection de l’Enfance, Septembre 2013",2013-11-07,"http://reliefweb.int/node/613952"
"613873","Dim prospects for media freedom in northern Mali after French journalists' murder",2013-11-07,"http://reliefweb.int/node/613873"
"613806","Slideshow: Mali's Lesson in Resilience",2013-11-06,"http://reliefweb.int/node/613806"
"613728","Change Through Cowpeas: In Mali, WFP Empowers Women Farmers",2013-11-06,"http://reliefweb.int/node/613728"
"613727","Mali - Child Protection Sub Cluster: Child Protection Dashboard on Needs, Response and Gaps, September 2013",2013-11-06,"http://reliefweb.int/node/613727"
"613715","Bamako - Mali : Répartition des déplacés par commune (Octobre 2013)",2013-11-06,"http://reliefweb.int/node/613715"
"613714","Mali: Répartition des déplacés par région (Octobre 2013)",2013-11-06,"http://reliefweb.int/node/613714"
"613640","‘Now is the time for action,’ UN chief says in key address at start of Sahel visit",2013-11-06,"http://reliefweb.int/node/613640"
"613620","À Bamako, soutien unanime à la stratégie de l'ONU pour le Sahel",2013-11-06,"http://reliefweb.int/node/613620"
"613602","La BAD dégage 4 milliards de dollars pour faire du Sahel une zone de stabilité et de croissance économique",2013-11-05,"http://reliefweb.int/node/613602"
"613592","Matrice de suivi des déplacements – Mali (Octobre 2013)",2013-11-05,"http://reliefweb.int/node/613592"
"613568","Une rentrée difficile pour les écoles du nord du Mali",2013-11-05,"http://reliefweb.int/node/613568"
"613556","Au secours des enfants des rues",2013-11-05,"http://reliefweb.int/node/613556"
"613451","European Union maintains its commitment to Mali",2013-11-05,"http://reliefweb.int/node/613451"
"613450","Mali internally displaced fall to 283,000",2013-11-05,"http://reliefweb.int/node/613450"
"613430","Quel avenir pour les éleveurs du Sahel?",2013-11-05,"http://reliefweb.int/node/613430"
"613361","Plus de huit milliards de dollars annoncés pour briser le cycle des crises au Sahel, se félicite Ban",2013-11-05,"http://reliefweb.int/node/613361"
"613349","Education au Sahel : Cap sur l’employabilité et la sécurité alimentaire",2013-11-04,"http://reliefweb.int/node/613349"
"613333","Trois mouvements rebelles touraeg et arabe annoncent leur fusion (déclaration)",2013-11-04,"http://reliefweb.int/node/613333"
"613327","West Africa Seasonal Monitor November 3, 2013",2013-11-04,"http://reliefweb.int/node/613327"
"613324","Three Malian Tuareg and Arab rebel movements announce merger",2013-11-04,"http://reliefweb.int/node/613324"
"613301","Over $8 billion pledged for Africa’s Sahel region as global leaders begin UN-led visit",2013-11-04,"http://reliefweb.int/node/613301"
"613275","Un véhicule saute sur une mine dans le nord du Mali: quatre morts",2013-11-04,"http://reliefweb.int/node/613275"
"613267","Four killed as truck hits landmine in north Mali",2013-11-04,"http://reliefweb.int/node/613267"
"613198","Mali : Aperçu humanitaire (au 31 octobre 2013)",2013-11-04,"http://reliefweb.int/node/613198"
"613184","Conclusions : Sixieme réunion du Groupe de soutien et de suivi sur la situation au Mali, Bamako, 2 Novembre 2013",2013-11-04,"http://reliefweb.int/node/613184"
"613181","Mali : Points de suivi des mouvements de populations - Flow monitoring points (FMP) du 20 au 26 Octobre 2013",2013-11-04,"http://reliefweb.int/node/613181"
"613171","Mali Perspectives sur la sécurité alimentaire Octobre 2013 à Mars 2014",2013-11-04,"http://reliefweb.int/node/613171"
"613139","La BAD jour un rôle clé dans la coordination de l’aide au Mali",2013-11-04,"http://reliefweb.int/node/613139"
"613136","Conclusions: Sixth meeting of the Support and Follow-up Group on the situation in Mali",2013-11-04,"http://reliefweb.int/node/613136"
"613129","Ban annonce son départ au Sahel aux côtés du Président de la Banque mondiale",2013-11-04,"http://reliefweb.int/node/613129"
"613127","Le Conseil de sécurité condamne le meurtre de deux journalistes français au Mali",2013-11-04,"http://reliefweb.int/node/613127"
"613124","AfDB plays a key role in donor coordination in Mali",2013-11-04,"http://reliefweb.int/node/613124"
"613092","Nord du Mali : Kidal, où ont été tués deux journalistes, zone de non-droit",2013-11-04,"http://reliefweb.int/node/613092"
"613087","Security Council strongly condemns killing of French journalists in Mali",2013-11-04,"http://reliefweb.int/node/613087"
"613003","UNICEF Mali Situation Report October 2013",2013-11-01,"http://reliefweb.int/node/613003"
"612997","UN chief, World Bank President announce joint visit to help Sahel region tackle ‘cycle of crises’",2013-11-01,"http://reliefweb.int/node/612997"
"612964","The Netherlands to contribute to UN mission in Mali",2013-11-01,"http://reliefweb.int/node/612964"
"612923","North Mali schools off to a hard start",2013-11-01,"http://reliefweb.int/node/612923"
"612921","Violent protest mars opening of conference on northern Mali",2013-11-01,"http://reliefweb.int/node/612921"
"612907","Violentes manifestations à Gao, ouverture à Bamako des assises sur le nord",2013-11-01,"http://reliefweb.int/node/612907"
"612904","What does the future hold for pastoralists in the Sahel?",2013-11-01,"http://reliefweb.int/node/612904"
"612901","Mali : 3W Présence opérationelle et programme - Qui fait, Quoi, Où (30 octobre 2013)",2013-11-01,"http://reliefweb.int/node/612901"
"612888","Sahel Crisis 2013: Funding status as of 1 November 2013",2013-11-01,"http://reliefweb.int/node/612888"
"612869","Mali: CAP 2013 - Suivi des Financements (au 1 novembre 2013)",2013-11-01,"http://reliefweb.int/node/612869"
"612848","West Africa Price Bulletin October 2013",2013-11-01,"http://reliefweb.int/node/612848"
"612816","Crimes de guerre présumés au Mali : aucun suspect identifié pour l'heure par la CPI (procureure)",2013-11-01,"http://reliefweb.int/node/612816"
"612793","Renforcer la résilience au Sahel par une gestion rationnelle de l’eau",2013-10-31,"http://reliefweb.int/node/612793"
"612775","Sound water management key to building resilience in Africa’s Sahel",2013-10-31,"http://reliefweb.int/node/612775"
"612718","Mali: 16,8 millions d'euros pour reconstruire les régions touchées par le conflit",2013-10-31,"http://reliefweb.int/node/612718"
"612646","Tchad : formation des militaires au droit international humanitaire avant leur déploiement au Mali",2013-10-31,"http://reliefweb.int/node/612646"
"612516","Sécurité alimentaire et implications humanitaires en Afrique de l’Ouest et au Sahel - Octobre 2013",2013-10-30,"http://reliefweb.int/node/612516"
"612303","Mali Bulletin des Prix octobre 2013",2013-10-29,"http://reliefweb.int/node/612303"
"612295","Situation Update: The Sahel Crisis - 29 October 2013",2013-10-29,"http://reliefweb.int/node/612295"
"612283","Mali Price Bulletin October 2013",2013-10-29,"http://reliefweb.int/node/612283"
"612274","Sahel : créer des communautés capables de résister aux chocs",2013-10-29,"http://reliefweb.int/node/612274"
"612204","Sahel 2013: Sector Strategic Indicators (January-August 2013)",2013-10-29,"http://reliefweb.int/node/612204"
"612197","Sahel et Afrique de l’Ouest : Hypothèses pour l’analyse trimestrielle de la sécurité alimentaire - Octobre 2013",2013-10-29,"http://reliefweb.int/node/612197"
"612148","Levée des mandats d'arrêt contre des chefs rebelles touareg",2013-10-29,"http://reliefweb.int/node/612148"
"612136","Mali : 3W - Présence Opérationnelle - Octobre 2013 (Cercle)",2013-10-29,"http://reliefweb.int/node/612136"
"612131","Séssion extraordinaire de la Conférence des Chefs d’Etat et de Gouvernement de la CEDEAO - communiqué final",2013-10-29,"http://reliefweb.int/node/612131"
"612058","Sécurité au Sahel: prochaine réunion de chefs militaires régionaux",2013-10-28,"http://reliefweb.int/node/612058"
"611955","Le renforcement de la concertation entre ONG et collectivités locales comme stratégie de reconstruction au Mali",2013-10-28,"http://reliefweb.int/node/611955"
"611890","Mali : Points de suivi des mouvements de populations - Flow monitoring points (FMP) du 13 au 19 Octobre 2013",2013-10-28,"http://reliefweb.int/node/611890"
"611885","Mali : Points de suivi des mouvements de populations - Flow monitoring points (FMP) du 06 au 12 Octobre 2013",2013-10-28,"http://reliefweb.int/node/611885"
"611769","Le conflit au Mali a ravivé les tensions ethniques",2013-10-28,"http://reliefweb.int/node/611769"
"611533","Les dirigeants ouest-africains appellent à renforcer la force de l'ONU au Mali",2013-10-25,"http://reliefweb.int/node/611533"
"611484","Sahel Crisis 2013: Funding status as of 25 October 2013",2013-10-25,"http://reliefweb.int/node/611484"
"611371","Rape, rockets and unrelenting fear -- Mali's troubles are far from over",2013-10-25,"http://reliefweb.int/node/611371"
"611301","Intentions de retour des personnes déplacées à Bamako, octobre 2013",2013-10-24,"http://reliefweb.int/node/611301"
"611299","Bureau régional pour l’Afrique de l’ouest et du centre: Bulletin - Fond central d’interventions d’urgence, troisième trimestre 2013",2013-10-24,"http://reliefweb.int/node/611299"
"611294","Regional Office for West and Central Africa Bulletin - Central Emergency Response Fund Third Quarter 2013",2013-10-24,"http://reliefweb.int/node/611294"
"611219","Apoyo de Cáritas Española a las emergencias declaradas en Malí, Camboya, Pakistán y Perú",2013-10-24,"http://reliefweb.int/node/611219"
"611218","USG Humanitarian assistance in the Sahel (as of 30 September 2013)",2013-10-24,"http://reliefweb.int/node/611218"
"611200","Mali Situation Update n° 21 August & September 2013",2013-10-24,"http://reliefweb.int/node/611200"
"611148","Mali - Cercle de Ménaka : Carte de référence (Octobre 2013)",2013-10-24,"http://reliefweb.int/node/611148"
"611147","Mali - Cercle d' Ansongo : Carte de référence (Octobre 2013)",2013-10-24,"http://reliefweb.int/node/611147"
"611145","L'Etat s'engage à accélérer la décentralisation",2013-10-24,"http://reliefweb.int/node/611145"
"611141","Mali - Cercle de Bourem : Carte de référence (Octobre 2013)",2013-10-24,"http://reliefweb.int/node/611141"
"611140","Mali - Région de Koulikoro - Cercle de Kolokani : Carte de référence (Octobre 2013)",2013-10-24,"http://reliefweb.int/node/611140"
"611139","Mali - Cercle de Gao : Carte de référence (Octobre 2013)",2013-10-24,"http://reliefweb.int/node/611139"
"611138","Mali - Région de Koulikoro - Cercle de Kati : Carte de référence (Octobre 2013)",2013-10-24,"http://reliefweb.int/node/611138"
"611137","Mali - Cercle de Dioïla : Carte de référence (Octobre 2013)",2013-10-24,"http://reliefweb.int/node/611137"
"611136","Mali - Cercle de Nara : Carte de référence (Octobre 2013)",2013-10-24,"http://reliefweb.int/node/611136"
"611135","Mali - Cercle de Kangaba : Carte de référence (Octobre 2013)",2013-10-24,"http://reliefweb.int/node/611135"
"611129","Ban condamne l'attentat-suicide qui a tué plusieurs Casques bleus tchadiens au Mali",2013-10-24,"http://reliefweb.int/node/611129"
"611092","Secretary-General condemns attack resulting in death of UN peacekeepers in Mali",2013-10-24,"http://reliefweb.int/node/611092"
"611075","Sahel Food Insecurity and Complex Emergency - Fact Sheet #6 (FY) 2013",2013-10-24,"http://reliefweb.int/node/611075"
"611068","Un petit groupe lié à Al-Qaïda revendique l'attaque à Tessalit",2013-10-24,"http://reliefweb.int/node/611068"
"611002","Mali conflict inflames ethnic tensions",2013-10-23,"http://reliefweb.int/node/611002"
"610970","Mutinous soldiers captured and killed in purge",2013-10-23,"http://reliefweb.int/node/610970"
"610951","Nouvelle attaque jihadiste meurtrière au Mali, les soldats tchadiens visés",2013-10-23,"http://reliefweb.int/node/610951"
"610950","Two Chadian soldiers, civilian killed in Mali militant attack",2013-10-23,"http://reliefweb.int/node/610950"
"610907","Un partenariat fort avec une ONG médicale - ALIMA/AMCP",2013-10-23,"http://reliefweb.int/node/610907"
"610818","UN: New Strategies Needed to Cope With Crises in Sahel",2013-10-23,"http://reliefweb.int/node/610818"
"610810","Achieving Strong and Inclusive Growth with Macroeconomic Stability",2013-10-23,"http://reliefweb.int/node/610810"
"610803","Not so fast: rush to return Malians carries risks",2013-10-22,"http://reliefweb.int/node/610803"
"610799","Urgent request for funding as donors desert Mali",2013-10-22,"http://reliefweb.int/node/610799"
"610755","L'heure est à la prévention de la malnutrition au Sahel",2013-10-22,"http://reliefweb.int/node/610755"
"610441","Sahel Humanitarian Dashboard (as of October 2013)",2013-10-21,"http://reliefweb.int/node/610441"
"610428","Mali president extends hand to Tuareg minority",2013-10-21,"http://reliefweb.int/node/610428"
"610390","""Etats généraux"" à Bamako pour répondre aux ""frustrations"" des Touareg",2013-10-21,"http://reliefweb.int/node/610390"
"610123","Death toll from Mali boat accident rises to 72",2013-10-19,"http://reliefweb.int/node/610123"
"610073","Wake-Up Call Needed Despite Progress in Mali: Interview with Bert Koenders",2013-10-18,"http://reliefweb.int/node/610073"
"610036","L’Expert indépendant de l’ONU effectuera sa première visite au Mali afin d’examiner la situation des droits de l’homme dans le pays",2013-10-18,"http://reliefweb.int/node/610036"
"609990","Sahel Crisis 2013: Funding status as of 18 October 2013",2013-10-18,"http://reliefweb.int/node/609990"
"609946","Mali: Humanitarian Bulletin, September 2013",2013-10-18,"http://reliefweb.int/node/609946"
"609940","Mali recovery hampered by poverty and food insecurity",2013-10-18,"http://reliefweb.int/node/609940"
"609780","France to keep 2,000 troops in Mali until end of year",2013-10-17,"http://reliefweb.int/node/609780"
"609759","Paris maintiendra plus de 2.000 soldats au Mali jusqu'aux législatives (ministre)",2013-10-17,"http://reliefweb.int/node/609759"
"609599","L'UE fait le bilan de l'observation des élections présidentielles et lance une mission d'observation pour les législatives",2013-10-17,"http://reliefweb.int/node/609599"
"609546","Pour le chef de la MINUSMA, en dépit de progrès, le «vrai travail» ne fait que commencer",2013-10-17,"http://reliefweb.int/node/609546"
"609518","Malgré la bonne tenue du scrutin présidentiel et le déploiement de la Minusma, « le vrai travail ne fait que commencer au Mali », estime le représentant spécial",2013-10-16,"http://reliefweb.int/node/609518"
"609463","Despite recent progress, urgent challenges remain to restore stability in Mali – UN envoy",2013-10-16,"http://reliefweb.int/node/609463"
"609457","For Many Malians, Especially Those Uprooted by Conflict, Life Is Fragile",2013-10-16,"http://reliefweb.int/node/609457"
"609456","Mali : l'ONU réclame des troupes et des hélicoptères pour la Minusma",2013-10-16,"http://reliefweb.int/node/609456"
"630741","Point sur la situation alimentaire au Sahel - Suivi de campagne n°150 - début octobre 2013",2013-10-16,"http://reliefweb.int/node/630741"
"609220","The Mali presidential elections: outcomes and challenges",2013-10-15,"http://reliefweb.int/node/609220"
"609136","A Gao, où les islamistes rôdent encore, la colère gronde contre l'Etat malien",2013-10-15,"http://reliefweb.int/node/609136"
"608944","Time to prevent child malnutrition in Sahel",2013-10-14,"http://reliefweb.int/node/608944"
"608907","EFSA Nord Mali : Prévalence de l'Insécurité Alimentaire Sévère Selon le Zones de Moyens d`Existence (septembre 2013)",2013-10-14,"http://reliefweb.int/node/608907"
"608904","Internal displacement in Mali since March 2013 (As of 25th September 2013)",2013-10-14,"http://reliefweb.int/node/608904"
"608881","EFSA Nord Mali : Consommation Alimentaire Pauvre Selon le Zones de Moyens d'Existence (septembre 2013)",2013-10-14,"http://reliefweb.int/node/608881"
"608879","EFSA Nord Mali : Prévalence de l'Insécurité Alimentaire Sévère (septembre 2013)",2013-10-14,"http://reliefweb.int/node/608879"
"608872","EFSA Nord Mali : Synthèse du Score de Consommation Alimentaire et Stratégie d'Urgences (septembre 2013)",2013-10-14,"http://reliefweb.int/node/608872"
"608852","Les progrès timides du Mali pour protéger les anciens enfants-soldats",2013-10-14,"http://reliefweb.int/node/608852"
"608746","Vers la levée de mandats d'arrêt contre certains chefs de groupes armés (ministre)",2013-10-14,"http://reliefweb.int/node/608746"
"608591","Make No Mistake: Mali’s Displacement Crisis Isn’t Over",2013-10-11,"http://reliefweb.int/node/608591"
"608523","Sahel Crisis 2013: Funding status as of 11 October 2013",2013-10-11,"http://reliefweb.int/node/608523"
"608503","Le Mali renoue avec l’espoir - Bulletin du terrain, août 2013",2013-10-11,"http://reliefweb.int/node/608503"
"608486","Malgré un lent retour à la stabilité, pas de solutions durables en vue pour bon nombre de PDI",2013-10-11,"http://reliefweb.int/node/608486"
"608471","Stability slowly returning but durable solutions a remote possibility for many IDPs",2013-10-11,"http://reliefweb.int/node/608471"
"608314","Piecing together the jigsaw - Prospects for improved social relations after the armed conflict in northern Mali",2013-10-10,"http://reliefweb.int/node/608314"
"608269","La Cooperación Española apoya el lanzamiento de la Agencia Regional para la Agricultura y la Alimentación de la CEDEAO",2013-10-10,"http://reliefweb.int/node/608269"
"608513","Mali takes baby steps toward protecting former child soldiers",2013-10-10,"http://reliefweb.int/node/608513"
"608242","660 000 enfants à risque de malnutrition aiguë",2013-10-10,"http://reliefweb.int/node/608242"
"608241","Une dizaine de combattants islamistes tués début octobre",2013-10-10,"http://reliefweb.int/node/608241"
"608227","Reconstruire la mosaïque - Perspectives pour de meilleures relations sociales après le conflit armé au Nord du Mali",2013-10-10,"http://reliefweb.int/node/608227"
"608183","Lettre datée du 2 octobre 2013, adressée au Secrétaire général par le Représentant permanent du Mali (S/2013/586)",1970-01-16,"http://reliefweb.int/node/608183"
"608180","Rapport du Secrétaire général sur la situation au Mali (S/2013/582)",2013-10-10,"http://reliefweb.int/node/608180"
"608071","Report of the Secretary-General on the situation in Mali (S/2013/582)",2013-10-09,"http://reliefweb.int/node/608071"
"608046","Mali Bulletin humanitaire, septembre 2013",2013-10-09,"http://reliefweb.int/node/608046"
"607884","EFSA Nord Mali : Consommation alimentaire pauvre (septembre 2013)",2013-10-09,"http://reliefweb.int/node/607884"
"607632","Nord du Mali: les islamistes multiplient les actions, dynamitent un pont au sud de Gao",2013-10-08,"http://reliefweb.int/node/607632"
"607396","Letter dated 2 October 2013 from the Permanent Representative of Mali to the United Nations addressed to the Secretary-General (S/2013/586)",2013-10-07,"http://reliefweb.int/node/607396"
"607349","ECOWAS launches regional agency for agriculture and food security",2013-10-07,"http://reliefweb.int/node/607349"
"607294","Nord du Mali: les islamistes tirent à l'arme lourde sur Gao",2013-10-07,"http://reliefweb.int/node/607294"
"607291","Islamists shell Gao in northern Mali: army",2013-10-07,"http://reliefweb.int/node/607291"
"607243","Le lent processus de remise sur pied des hôpitaux au Mali",2013-10-07,"http://reliefweb.int/node/607243"
"607238","L’OIM débute une évaluation des besoins au nord du Mali",2013-10-07,"http://reliefweb.int/node/607238"
"607149","On the Road to Recovery?",2013-10-07,"http://reliefweb.int/node/607149"
"607413","660,000 children facing severe malnutrition",2013-10-07,"http://reliefweb.int/node/607413"
"607114","Mali Food Security Outlook Update September 2013",2013-10-07,"http://reliefweb.int/node/607114"
"607098","Nord Mali : publication d'un texte inédit du chef d'Aqmi",2013-10-07,"http://reliefweb.int/node/607098"
"607085","Les rebelles touareg et arabes reprennent les discussions avec Bamako (déclaration)",2013-10-07,"http://reliefweb.int/node/607085"
"607042","Tuareg, Arab rebels resume Mali peace talks",2013-10-06,"http://reliefweb.int/node/607042"
"606986","Le Programme alimentaire mondial renforce son aide au Mali",2013-10-04,"http://reliefweb.int/node/606986"
"606965","UN food relief agency scales up assistance in Mali to combat effects of drought, conflict",2013-10-04,"http://reliefweb.int/node/606965"
"606884","Mali : faits et chiffres -- juillet 2013",2013-10-04,"http://reliefweb.int/node/606884"
"606876","Sahel Crisis 2013: Funding status as of 04 October 2013",2013-10-04,"http://reliefweb.int/node/606876"
"606831","Northern Mali needs assessment launched",2013-10-04,"http://reliefweb.int/node/606831"
"606633","Slow healing for Mali hospitals",2013-10-03,"http://reliefweb.int/node/606633"
